App,Descriptions
Photo Editor & Candy Camera & Grid & ScrapBook,Filters for photos and videos Beautification tools for flawless selfies
Coloring book moana,Welcome this app for Coloring Book Encanto Cartoon
"U Launcher Lite – FREE Live Cool Themes, Hide Apps","Android themes & 4D Live wallpaper, Hide apps"
Sketch - Draw & Paint,Sketch and paint on your device with the feel and freedom of drawing on paper
Pixel Draw - Number Art Coloring Book,Coloring games are a good way to relax! Paint by number to enjoy coloring book!
Paper flowers instructions,We Have Many Paper Flower Tutorial Here!
Smoke Effect Photo Maker - Smoke Editor,Add amazing smoke effect on photo using smoking photo editor
Infinite Painter,"Painting, drawing, & sketching"
Garden Coloring Book,A magical mind journey in Colorfit Garden Coloring Book
Kids Paint Free - Drawing Fun,"Paint is an easy to use painting, drawing or scribbling app. NO FULL SCREEN ADS."
Text on Photo - Fonteee,Text on photo editor | Add text to photos | Typography app to write on images
Name Art Photo Editor - Focus n Filters,"Create awesome, amazing and beautiful love card with Name Art - Focus n Filter"
Tattoo Name On My Photo Editor,Tattoo my photo with my name is tattoo design apps for girls name tattoo app
Mandala Coloring Book,Coloring pages with mandalas for adults
3D Color Pixel by Number - Sandbox Art Coloring,Coloring games are a good way to relax! Paint by number to enjoy coloring book!
Learn To Draw Kawaii Characters,How to draw Kawaii & cute characters: step-by-step painting tutorials
Photo Designer - Write your name with shapes,Be a PRO photo text editor! Write on photos - add text to photos easily!
350 Diy Room Decor Ideas,This fun list of DIY room decorating ideas for teens has a little of everything
FlipaClip - Cartoon animation,Unlock your imagination and start animating in just a few minutes!
ibis Paint X,Share the joy of painting with ibis Paint X! Drawing anime and manga art.
Logo Maker - Small Business,"Graphic Design: Use 7000+ Logo Templates, Backgrounds & Fonts by logo generator"
Boys Photo Editor - Six Pack & Men's Suit,Men Abs Editor is a best abs booth and men body builder photo editor application
Superheroes Wallpapers | 4K Backgrounds,Make your smartphone cool with our Superheroes Wallpapers App.
Mcqueen Coloring pages,lightning Coloring cars- mcqueen book is an application to train our imagination
HD Mickey Minnie Wallpapers,many option Cute Micky Wallpapers - 1000+ Wallpapers
Harley Quinn wallpapers HD,Get your favourite HarleyQuinn Wallpaper Daily
Colorfit - Drawing & Coloring,1000+pages: Drawing creation your own mandala. Anxiety and stress relieving
Animated Photo Editor,Toon up your photos with hundreds of styles and art lens in ToonMe.
Pencil Sketch Drawing,Create beautiful pencil sketch & drawing of your photos with Pencil Photo Sketch
Easy Realistic Drawing Tutorial,Learn Pencil Drawing Realistic Technique and Pencil Shading
Pink Silver Bow Keyboard Theme,Stylish Pink Bow Diamond keyboard with 10000+ customized keyboard themes!
Art Drawing Ideas,A collection of the best drawing design art ideas for beginners
Anime Manga Coloring Book,All Anime in One Shining Place
Easy Origami Ideas,Collection of Simple and Easy Origami Ideas
I Creative Idea,Learn Something New Everyday.App allow you to show your creativity to the world.
How to draw Ladybug and Cat Noir,"Miraculous Ladybug players, let's run, dash, rush in an adventure running game!"
UNICORN - Color By Number & Pixel Art Coloring,Color by number in our unicorn games!
Floor Plan Creator,"Floor Plan Creator lets you create, edit and share floor plans."
PIP Camera - PIP Collage Maker,"PIP Camera photo editor, PiP collage maker is best way to creative PIP photos"
How To Color Disney Princess - Coloring Pages,"In Disney Coloring World, kids get creative with their favorite characters!"
Drawing Clothes Fashion Ideas,Update Drawing Clothes Fashion Ideas (Collection Image)
Sad Poetry Photo Frames 2018,"Create Photo frames with new sad poetry photo frames, for free."
Textgram - write on photos,"Create beautiful Photos and share Design on Facebook, Twitter, Instagram"
Paint Splash!,Dye everything around you in the colors of your team! Join the battle of colors!
Popsicle Sticks and Similar DIY Craft Ideas,"Get DIY Ideas, art & craft tips, DIY projects with step by step tutorials."
"Canva: Poster, banner, card maker & graphic design","Your background remover, photo editor & video editor"
Install images with music to make video without Net - 2018,"Make photo slideshow & video with music, video effect, glitch, text, sticker."
Little Teddy Bear Colouring Book Game,Educational coloring game with cute teddy
How To Draw Food,Step by step instructions of varying complexity. Drawing lessons for all ages
Monster Truck Stunt 3D 2019,Monster Truck Stunt 3D - Car Driving Simulator Games
Real Tractor Farming,Play farming games to learn modern tractor farming rule in tractor games
Ultimate F1 Racing Championship,Offline formula one car racing game featuring famous F1 cars from all races 2023
Used Cars and Trucks for Sale,"Shop millions of cars with deal ratings, save favorites, and get price alerts."
American Muscle Car Race,This game brings to you amazing experience with classic cars from 50s - 80s !!!
Offroad Oil Tanker Driver Transport Truck 2019,Drive US Army Transporter Oil Tanker Cargo Transport Truck Drive 3D Game
Tickets SDA 2018 and Exam from the State Traffic Safety Inspectorate with Drom.ru,"Dmv Permit Practice with all Traffic Signs, Signals, Road Signs, & drivers test"
Gas Prices (Germany only),Find the cheapest petrol station in Germany - always and everywhere.
Extreme Rally Championship,Rally Championship will take you to the limit of driving in the Rally world.
Restart Navigator,This app help you to get Power Menu
"REG - Check the regnumber, find information about Swedish vehicles",Instantly check the vehicle information & specs via trusted VIN decoder
CityBus Lviv,Smart app for online tracking public transport of Lviv
CDL Practice Test 2018 Edition,CDL Prep + CDL Practice Tests. CDL Prep for License Exam and PASS easily
"ezETC (ETC balance inquiry, meter trial, real-time traffic)","Real-time, GPS guided traffic, incidents, and road conditions with weather."
Free VIN Report for Used Cars,VIN Report | VIN Check | VIN Lookup. Don't Buy a Used Car Without It.
DMV Permit Practice Test 2018 Edition,"DMV Permit Practice Test, Drivers License Learners Prep & CDL App for all states"
Check Vehicle Tax,Reveal everything you need to know about the history of a used car.
Used Cars Mexico,Autolist - The Largest Selection of Local Used Cars and Trucks
Ulysse Speedometer,★★★★★ Drive safely!
REPUVE,Consultation of public information in the Public Registry Office (REPUVE)
Used cars for sale - Trovit,Find all the cars for sale listed anywhere in one place!
"Fines of the State Traffic Safety Inspectorate are official: inspection, payment of fines",This app provides the details about the traffic violations and its fines
SK Enca Direct Malls - Used Cars Search,"Shop millions of cars with deal ratings, save favorites, and get price alerts."
"Android Auto - Maps, Media, Messaging & Voice","Control maps, media and messaging, with the Google Assistant while you drive"
PDD-UA,Official traffic regulations of Ukraine from the Monolith publishing house are always at hand!
Tickets SDA 2019 + Exam RF,"Download Testbook KPSC FDA SDA Preparation App for Mock Tests, Notes, Updates."
Super Cars Wallpapers And Backgrounds,"Download 4K Car Wallpapers, HD supercar wallpapers & latest sport car images"
"Police Lights, Sirens & Follow Me",Police Light and Siren simulator panel on your mobile phone to make a prank:)
Police Detector (Speed Camera Radar),Police Radar - Be aware of the location of fixed and portable speed radars
Best Car Wallpapers,"Cool Supercars Wallpapers like Lamborghini Wallpapers, Audi, Bugatti & more."
Tickets + PDA 2018 Exam,"Buy and sell concert, sports, broadway, theater, NFL, MLB & last minute tickets."
Pick Your Part Garage,This app is a simple and fast way to get the latest information about PYP
PakWheels: Buy & Sell Cars,"Buy & sell cars, bikes & autoparts. Find new car prices, news, videos & reviews."
Supervision service,"SuperVPN, Fast Secure VPN service. Easy to use, one click to connect, unlimited"
Speed Camera Detector - Traffic & Speed Alert,Speedcam alerts and navigation. 100% Legal and Reliable. Never pay another fine!
Used car search Goo net whole car Go to net,"With the used car app, you can search and select a car by selling price or model of car! Search for your ideal used car from a wealth of car information! Safe used car search app for first-time car buyers"
CarMax – Cars for Sale: Search Used Car Inventory,"Find, search, and browse 50,000+ used cars, trucks, or SUVs."
BEST CAR SOUNDS,Over 170 Car Sounds - DOWNLOAD NOW
RST - Sale of cars on the PCT,"Shop millions of cars with deal ratings, save favorites, and get price alerts."
AutoScout24 Switzerland – Find your new car,The biggest marketplace for new and used cars in Switzerland.
Zona Azul Digital Fácil SP CET - OFFICIAL São Paulo,Carnival just got safer. Buy and activate your CAD and park on the streets of SP
SMS Park,Easily pay for parking
SKencar,"Korea's leading used car platform, Encar"
Fuelio: Gas log & costs,"Car management, gas prices, consumption, expenses, mileage log, GPS tracker"
auto fines,Bejaan Traffic Bangalore Check Fines - Violation Challan details with photo
"Used car is the first car - used car purchase, used car quotation, dealer information to",Autolist - The Largest Selection of Local Used Cars and Trucks
All of the parking lot - National Park application (parking lot search / parking sharing / discount payment),"Park in Chicago, NYC, Boston, SF, Houston & more!"
Inquiry Fines and Debits of Vehicles,This app provides the details about the traffic violations and its fines
Gas Station,Gas attendant simulator
Hush - Beauty for Everyone,Top brand haircare & fragrance
"ipsy: Makeup, Beauty, and Tips",Discover the best in beauty + insider tips with our monthly makeup subscriptions
Natural recipes for your beauty,"Health tips for every day. App for your healthy lifestyle, beauty and recipes."
"BestCam Selfie-selfie, beauty camera, photo editor","Create the perfect selfie! Custom beauty cam, stickers & filters for pictures"
Mirror - Zoom & Exposure -,Zoomable smart mirror that can be used in dark places.
Beauty Selfie Camera,Get the perfect photo EVERY time with our amazing Auto-Beautification tool
Hairstyles step by step,Hairstyles step by step easy DIY tutorials for girls and women offline & online.
Filters for Selfie,"Get alot of filters like dogs, rabbit, eyes, hair, wolf, lips, heart crown..."
Tie - Always be happy,"True Tie Teaches you how to tie a tie... Windsor, Half Windsor, Four in Hand ..."
Ulta Beauty,Top brand haircare & fragrance
Prom MakeUp Tutorial,Tips for makeup for the girls that like to do makeup.
Selfie Camera,"Beauty camera and photo editor with filters, stickers, and pic collage maker"
Sweet Selfie Beauty Camera,"Beauty camera and photo editor with filters, stickers, and pic collage maker"
Colors of white in Urdu,Shapes & Colors learning for kids with Test & Practice mode in Urdu.
Selfie Camera Photo Editor & Filter & Sticker,"Funny photo filters and effects & selfie camera effects, art face filter camera!"
Wrinkles and rejuvenation,Wrinkles Pro app specializing in beauty and treating skin wrinkles.
Eyes Makeup Beauty Tips,Eye Makeup Step By Step images and Video Tutorial
Photo Editor 2018,"AI photo editor & cartoon photo editor for collage maker, profile maker & aging"
Step By Step Eyes Makeup Tutorial,Eye Makeup Step By Step images and Video Tutorial
Beauty Camera - Selfie Camera,"Selfie Camera is a HD beauty camera with live AR stickers, photo editor."
Girls Hairstyles,Girls Hairstyles is girls app to add hairstyle on photo. Hairstyles for girls
Mirror Camera (Mirror + Selfie Camera),Let phone become a best mirror. Handy! Press mirror region to show/hide menu.
Beauty Tips - Beauty Tips in Sinhala,This app includes all kinds of beauty tips and treatments
Haircut Tutorials/Haircut Videos,"Step by step hairstyles tutorials, hairstyles for girls, hairstyles videos"
"Sephora: Skin Care, Beauty Makeup & Fragrance Shop",Best-selling makeup from top brands. Try makeup products with skincare benefits!
Manicure - nail design,* Design your own nail art instantly! *
"Sticker Camera - Selfie Filters, Beauty Camera",Get the perfect photo EVERY time with our amazing Auto-Beautification tool
Filters for B Live,"Face camera filters and effects & funny face filters for kids, fun filter camera"
Skin Care and Natural Beauty,The beauty app to get your skin glow back. Skin care recommendations and tips
Facial Wrinkle Reduction,"DIY Wrinkle treatment , remover Home Remedies and important tips to prevent them"
Makeup Videos,"MakeUp Videos, Make Up Tutorials and Tips, Beauty Care Tips, Beauty Tips"
"Secrets of beauty, youth and health",Beautiful body and a healthy spirit. Take care of yourself without leaving home
Recipes and tips for losing weight,Reduce your weight and stay healthy always!
Discover Color,"""Take Colors From The World Around You"""
Eyeliner step by step 2018,step by step for cat eye makeup tutorial in images & explain eyeliner tutorial
Dresses Ideas & Fashions +3000,Dresses Ideas & Fashions +3000
"Lady adviser (beauty, health)",Beautiful body and a healthy spirit. Take care of yourself without leaving home
Step By Step Hairstyles For Women,Hairstyles step by step easy DIY tutorials for girls and women offline & online.
Rainbow Camera,This Is the Easy Way to Make Rainbow Light Filters for Your Selfies
Methods of teeth whitening,Get perfect smiles with whitened teeths and plumped lips
Girls hairstyles 2018,Girls Hairstyles is girls app to add hairstyle on photo. Hairstyles for girls
Wattpad 📖 Free Books,"Wattpad - A Story Reading App, Read Stories, Novels, Ebooks and Write Stories"
E-Book Read - Read Book for free,"Your library in your pocket. Anytime, anywhere."
Download free book with green book,All the books you love. On the page or out loud. Anywhere you are.
Wikipedia,"The official app for Wikipedia, the world’s largest source of information."
Amazon Kindle,"Your library in your pocket. Anytime, anywhere."
Cool Reader,"Reading books in epub, fb2, txt, doc, rtf, html, chm, tcr, pdb, pml formats."
Dictionary - Merriam-Webster,America's most useful and respected dictionary.
NOOK: Read eBooks & Magazines,Barnes & Noble’s award-winning digital discovery experience
Free Panda Radio Music,"Get instant access to your favorite artists, albums, playlists, and podcasts"
Book store,All the books you love. On the page or out loud. Anywhere you are.
FBReader: Favorite Book Reader,"E-book reader. Multi-format, highly customizable. Supports cloud synchronization"
English Grammar Complete Handbook,Learn English Grammar with real-life examples and easy-to-understand definitions
Free Books - Spirit Fanfiction and Stories,"Discover and love, several books (Original Stories and Fanfiction)"
Google Play Books,All the books you love. On the page or out loud. Anywhere you are.
Photo Editor & Candy Camera & Grid & ScrapBook,Filters for photos and videos Beautification tools for flawless selfies
Coloring book moana,Welcome this app for Coloring Book Encanto Cartoon
"U Launcher Lite – FREE Live Cool Themes, Hide Apps","Android themes & 4D Live wallpaper, Hide apps"
Sketch - Draw & Paint,Sketch and paint on your device with the feel and freedom of drawing on paper
Pixel Draw - Number Art Coloring Book,Coloring games are a good way to relax! Paint by number to enjoy coloring book!
Paper flowers instructions,We Have Many Paper Flower Tutorial Here!
Smoke Effect Photo Maker - Smoke Editor,Add amazing smoke effect on photo using smoking photo editor
Infinite Painter,"Painting, drawing, & sketching"
Garden Coloring Book,A magical mind journey in Colorfit Garden Coloring Book
Kids Paint Free - Drawing Fun,"Paint is an easy to use painting, drawing or scribbling app. NO FULL SCREEN ADS."
Text on Photo - Fonteee,Text on photo editor | Add text to photos | Typography app to write on images
Name Art Photo Editor - Focus n Filters,"Create awesome, amazing and beautiful love card with Name Art - Focus n Filter"
Tattoo Name On My Photo Editor,Tattoo my photo with my name is tattoo design apps for girls name tattoo app
Mandala Coloring Book,Coloring pages with mandalas for adults
3D Color Pixel by Number - Sandbox Art Coloring,Coloring games are a good way to relax! Paint by number to enjoy coloring book!
Learn To Draw Kawaii Characters,How to draw Kawaii & cute characters: step-by-step painting tutorials
Photo Designer - Write your name with shapes,Be a PRO photo text editor! Write on photos - add text to photos easily!
350 Diy Room Decor Ideas,This fun list of DIY room decorating ideas for teens has a little of everything
FlipaClip - Cartoon animation,Unlock your imagination and start animating in just a few minutes!
ibis Paint X,Share the joy of painting with ibis Paint X! Drawing anime and manga art.
Logo Maker - Small Business,"Graphic Design: Use 7000+ Logo Templates, Backgrounds & Fonts by logo generator"
Boys Photo Editor - Six Pack & Men's Suit,Men Abs Editor is a best abs booth and men body builder photo editor application
Superheroes Wallpapers | 4K Backgrounds,Make your smartphone cool with our Superheroes Wallpapers App.
Mcqueen Coloring pages,lightning Coloring cars- mcqueen book is an application to train our imagination
HD Mickey Minnie Wallpapers,many option Cute Micky Wallpapers - 1000+ Wallpapers
Harley Quinn wallpapers HD,Get your favourite HarleyQuinn Wallpaper Daily
Colorfit - Drawing & Coloring,1000+pages: Drawing creation your own mandala. Anxiety and stress relieving
Animated Photo Editor,Toon up your photos with hundreds of styles and art lens in ToonMe.
Pencil Sketch Drawing,Create beautiful pencil sketch & drawing of your photos with Pencil Photo Sketch
Easy Realistic Drawing Tutorial,Learn Pencil Drawing Realistic Technique and Pencil Shading
Pink Silver Bow Keyboard Theme,Stylish Pink Bow Diamond keyboard with 10000+ customized keyboard themes!
Art Drawing Ideas,A collection of the best drawing design art ideas for beginners
Anime Manga Coloring Book,All Anime in One Shining Place
Easy Origami Ideas,Collection of Simple and Easy Origami Ideas
I Creative Idea,Learn Something New Everyday.App allow you to show your creativity to the world.
How to draw Ladybug and Cat Noir,"Miraculous Ladybug players, let's run, dash, rush in an adventure running game!"
UNICORN - Color By Number & Pixel Art Coloring,Color by number in our unicorn games!
Floor Plan Creator,"Floor Plan Creator lets you create, edit and share floor plans."
PIP Camera - PIP Collage Maker,"PIP Camera photo editor, PiP collage maker is best way to creative PIP photos"
How To Color Disney Princess - Coloring Pages,"In Disney Coloring World, kids get creative with their favorite characters!"
Drawing Clothes Fashion Ideas,Update Drawing Clothes Fashion Ideas (Collection Image)
Sad Poetry Photo Frames 2018,"Create Photo frames with new sad poetry photo frames, for free."
Textgram - write on photos,"Create beautiful Photos and share Design on Facebook, Twitter, Instagram"
Paint Splash!,Dye everything around you in the colors of your team! Join the battle of colors!
Popsicle Sticks and Similar DIY Craft Ideas,"Get DIY Ideas, art & craft tips, DIY projects with step by step tutorials."
"Canva: Poster, banner, card maker & graphic design","Your background remover, photo editor & video editor"
Install images with music to make video without Net - 2018,"Make photo slideshow & video with music, video effect, glitch, text, sticker."
Little Teddy Bear Colouring Book Game,Educational coloring game with cute teddy
How To Draw Food,Step by step instructions of varying complexity. Drawing lessons for all ages
Monster Truck Stunt 3D 2019,Monster Truck Stunt 3D - Car Driving Simulator Games
Real Tractor Farming,Play farming games to learn modern tractor farming rule in tractor games
Ultimate F1 Racing Championship,Offline formula one car racing game featuring famous F1 cars from all races 2023
Used Cars and Trucks for Sale,"Shop millions of cars with deal ratings, save favorites, and get price alerts."
American Muscle Car Race,This game brings to you amazing experience with classic cars from 50s - 80s !!!
Offroad Oil Tanker Driver Transport Truck 2019,Drive US Army Transporter Oil Tanker Cargo Transport Truck Drive 3D Game
Tickets SDA 2018 and Exam from the State Traffic Safety Inspectorate with Drom.ru,"Dmv Permit Practice with all Traffic Signs, Signals, Road Signs, & drivers test"
Gas Prices (Germany only),Find the cheapest petrol station in Germany - always and everywhere.
Extreme Rally Championship,Rally Championship will take you to the limit of driving in the Rally world.
Restart Navigator,This app help you to get Power Menu
"REG - Check the regnumber, find information about Swedish vehicles",Instantly check the vehicle information & specs via trusted VIN decoder
CityBus Lviv,Smart app for online tracking public transport of Lviv
CDL Practice Test 2018 Edition,CDL Prep + CDL Practice Tests. CDL Prep for License Exam and PASS easily
"ezETC (ETC balance inquiry, meter trial, real-time traffic)","Real-time, GPS guided traffic, incidents, and road conditions with weather."
Free VIN Report for Used Cars,VIN Report | VIN Check | VIN Lookup. Don't Buy a Used Car Without It.
DMV Permit Practice Test 2018 Edition,"DMV Permit Practice Test, Drivers License Learners Prep & CDL App for all states"
Check Vehicle Tax,Reveal everything you need to know about the history of a used car.
Used Cars Mexico,Autolist - The Largest Selection of Local Used Cars and Trucks
Ulysse Speedometer,★★★★★ Drive safely!
REPUVE,Consultation of public information in the Public Registry Office (REPUVE)
Used cars for sale - Trovit,Find all the cars for sale listed anywhere in one place!
"Fines of the State Traffic Safety Inspectorate are official: inspection, payment of fines",This app provides the details about the traffic violations and its fines
SK Enca Direct Malls - Used Cars Search,"Shop millions of cars with deal ratings, save favorites, and get price alerts."
"Android Auto - Maps, Media, Messaging & Voice","Control maps, media and messaging, with the Google Assistant while you drive"
PDD-UA,Official traffic regulations of Ukraine from the Monolith publishing house are always at hand!
Tickets SDA 2019 + Exam RF,"Download Testbook KPSC FDA SDA Preparation App for Mock Tests, Notes, Updates."
Super Cars Wallpapers And Backgrounds,"Download 4K Car Wallpapers, HD supercar wallpapers & latest sport car images"
"Police Lights, Sirens & Follow Me",Police Light and Siren simulator panel on your mobile phone to make a prank:)
Police Detector (Speed Camera Radar),Police Radar - Be aware of the location of fixed and portable speed radars
Best Car Wallpapers,"Cool Supercars Wallpapers like Lamborghini Wallpapers, Audi, Bugatti & more."
Tickets + PDA 2018 Exam,"Buy and sell concert, sports, broadway, theater, NFL, MLB & last minute tickets."
Pick Your Part Garage,This app is a simple and fast way to get the latest information about PYP
PakWheels: Buy & Sell Cars,"Buy & sell cars, bikes & autoparts. Find new car prices, news, videos & reviews."
Supervision service,"SuperVPN, Fast Secure VPN service. Easy to use, one click to connect, unlimited"
Speed Camera Detector - Traffic & Speed Alert,Speedcam alerts and navigation. 100% Legal and Reliable. Never pay another fine!
Used car search Goo net whole car Go to net,"With the used car app, you can search and select a car by selling price or model of car! Search for your ideal used car from a wealth of car information! Safe used car search app for first-time car buyers"
CarMax – Cars for Sale: Search Used Car Inventory,"Find, search, and browse 50,000+ used cars, trucks, or SUVs."
BEST CAR SOUNDS,Over 170 Car Sounds - DOWNLOAD NOW
RST - Sale of cars on the PCT,"Shop millions of cars with deal ratings, save favorites, and get price alerts."
AutoScout24 Switzerland – Find your new car,The biggest marketplace for new and used cars in Switzerland.
Zona Azul Digital Fácil SP CET - OFFICIAL São Paulo,Carnival just got safer. Buy and activate your CAD and park on the streets of SP
SMS Park,Easily pay for parking
SKencar,"Korea's leading used car platform, Encar"
Fuelio: Gas log & costs,"Car management, gas prices, consumption, expenses, mileage log, GPS tracker"
auto fines,Bejaan Traffic Bangalore Check Fines - Violation Challan details with photo
"Used car is the first car - used car purchase, used car quotation, dealer information to",Autolist - The Largest Selection of Local Used Cars and Trucks
All of the parking lot - National Park application (parking lot search / parking sharing / discount payment),"Park in Chicago, NYC, Boston, SF, Houston & more!"
Inquiry Fines and Debits of Vehicles,This app provides the details about the traffic violations and its fines
Gas Station,Gas attendant simulator
Hush - Beauty for Everyone,Top brand haircare & fragrance
"ipsy: Makeup, Beauty, and Tips",Discover the best in beauty + insider tips with our monthly makeup subscriptions
Natural recipes for your beauty,"Health tips for every day. App for your healthy lifestyle, beauty and recipes."
"BestCam Selfie-selfie, beauty camera, photo editor","Create the perfect selfie! Custom beauty cam, stickers & filters for pictures"
Mirror - Zoom & Exposure -,Zoomable smart mirror that can be used in dark places.
Beauty Selfie Camera,Get the perfect photo EVERY time with our amazing Auto-Beautification tool
Hairstyles step by step,Hairstyles step by step easy DIY tutorials for girls and women offline & online.
