App,Descriptions
Gun AK 47,"Build a Gun, Weapons up, Shoot the enemies with Assault Rifle AK-47!"
AK Blackjack,Play Vegas BLACKJACK! Online or Offline Blackjack 21 Casino Games in BLACK JACK!
Jigsaw Puzzles AK 74M,20000+ HD jigsaw puzzle games. Daily games for adults. Train your brain.
AK-47 guns Sounds,Free AK-47 Sounds!
AK Phone,"Reliable phone calls with spam protection, caller ID and more helpful features"
AK Booster,"Game booster to reduce lag and ping. Supports Free Fire, Diablo, MLBB etc"
GUN ZOMBIE,Let's shoot zombies
Ak Parti Yardım Toplama,Companion Mobile App
AK Lodi Films,Cinematic Wedding Videogrpahy and Photography. “I Love What I Do!” - AK LODI
Gun Mod: Guns in Minecraft PE,Ultimate Guns & Weapons Mod for Minecraft PE. Coolest Mods Ever!
Kymco AK 550,Discover this high performance scooter with the 3D configurator!
AK Math Coach,Play and train all the basic arithmetic operations and more.
Shoot Strike War Fire,FPS & Full-finger touch & 3D Realistic & War! Play Ready? Fire! be Winner
AL.com,"Get the latest Alabama news, weather, sports and entertainment."
University of Alabama,The official app of The University of Alabama.
Alabama Gameday Live,The official app of the Alabama Crimson Tide.
AL.com: Alabama Football News,AL.com: Alabama Crimson Tide Football News
Alabama Road Trips,Discover all that Alabama has to offer with Alabama Road Trips.
Alabama DMV Permit Test - AL,Permit Test Prep Alabama DMV helps you prepare for AL DMV Knowledge Test ALDOT
Al-Quran (Free),"Beautiful Holy Quran App for Recitation, Free Download & Read Quran HD Easily"
Official AL Fishing & Hunting,Make your fishing and hunting effective with Fishing & Hunting Solunar Time!
Al Quran (Tafsir & by Word),Start your journey to a deeper understanding of the Quran!
Al-Moazin Lite (Prayer Times),"Al-Moazin, is the most accurate prayer times for mobiles and smart watches"
Al Quran Indonesia,Al Quran dengan terjemahan Bahasa Indonesia dan terdapat Jadwal Sholat.
Al'Quran Bahasa Indonesia,Al Quran dengan terjemahan Bahasa Indonesia dan terdapat Jadwal Sholat.
Al Quran Al karim,"Beautiful Holy Quran App for Recitation, Free Download & Read Quran HD Easily"
Al jazeera TV,"Global News, One App"
Al Jazeera English,"Global News, One App"
Al-Muhaffiz,Memorise Quran
Al Quran Audio (Full 30 Juz),Listening Murottal Al Quran Offline dan Read Al Quran Translations
Quran for All (Al-Huda Int.),"Excellent Android App to learn Islam! Comprehensive, authentic, reliable, simple"
AL Voice Recorder,Simple and easy to use voice recorder • High audio quality • Skip silence
Ayat - Al Quran,Comprehensive Quran App (Electronic Mosshaf) with unique features.
Quran Juz-30 - Mahad al Zahra,Memorise Quran
Al Quran : EAlim - Translations & MP3 Offline,"Audio Quran offline, read with translations and a minimal Qibla Compass"
Al Mayadeen,Stay updated and get the latest news on the go with Al Mayadeen News app.
Al-Quran Al-Muallim,Download mushaf al muallim khalil al hossary mp3 offline part 1 of 2
We're Working Out - Al Kavadlo,"Fun, challenging, full-body workouts and bodyweight exercises to do anywhere."
Al-Quran 30 Juz free copies,Al-Quran Al-Kareem 30 Juz is a free copies of Al-Quran in your Android Phone
Koran Read &MP3 30 Juz Offline,"Trusted by 5 Million Muslims Worldwide = Read Quran, Listen Quran, Qibla Finder"
Al Quran MP3 - Quran Reading®,"Al Quran Karim Application with MP3 Recitation, Translation & Transliteration"
Al'Quran Bahasa Indonesia PRO,Read the Koran in Indonesian
Hafizi Quran 15 lines per page,The application make easy to find out suras from the 15 line hefz quran sharif.
Al-Quran Ahmad Saud Offline,Listen to the beautiful recitation of Holy Quran by Ahmad Saud
12 Step Meditations & Sober Prayers AA NA AL-ANON,"Join the largest online AA community in the world - 400,000+ sober members."
Quran for Android,A beautiful Quran application for Android.
Al Quran Free - القرآن (Islam),"Beautiful Holy Quran App for Recitation, Free Download & Read Quran HD Easily"
Taha Al Junaid Quran Mp3,Murottal Muhammad Taha Al Junayd Full Quran MP3 100% Offline
Surah Al-Waqiah,Surah Waqiah is 56th chapter of Holy Quran.
"Muslim Pro - Prayer Times, Azan, Quran & Qibla","Quran, Prayer Times, Azan, Islamic Prayer Times, Qibla Finder, Salat, Qibla"
Hisnul Al Muslim - Hisn Invocations & Adhkaar,"Fortress of the Muslim, Invocations from the Quran and Sunnah"
I am rich,I am Rich : The most Expensive App | Rich Man App | Finance | Business | Money
I AM RICH,I am Rich : The most Expensive App | Rich Man App | Finance | Business | Money
I am Rich Plus,I am Rich : The most Expensive App | Rich Man App | Finance | Business | Money
I am rich VIP,I am Rich : The most Expensive App | Rich Man App | Finance | Business | Money
I Am Rich Premium,I am Rich : The most Expensive App | Rich Man App | Finance | Business | Money
I am extremely Rich,I am Rich : The most Expensive App | Rich Man App | Finance | Business | Money
I am Rich!,I am Rich : The most Expensive App | Rich Man App | Finance | Business | Money
I am rich(premium),I am Rich : The most Expensive App | Rich Man App | Finance | Business | Money
I am Rich Person,Become a billionaire tycoon in a life simulator! Do life choices & get the money
I am Rich Premium Plus,I am Rich : The most Expensive App | Rich Man App | Finance | Business | Money
I Am Rich Pro,I am Rich : The most Expensive App | Rich Man App | Finance | Business | Money
I Am Innocent,Interactive murder texting games Investigate detective thriller & solve the case
I am rich (Most expensive app),I am Rich : The most Expensive App | Rich Man App | Finance | Business | Money
i am rich,I am Rich : The most Expensive App | Rich Man App | Finance | Business | Money
I Am Rich,I am Rich : The most Expensive App | Rich Man App | Finance | Business | Money
I am Bread,Journey through different worlds in this epic side-scrolling adventure.
Where Am I At?,"Find and share current location, lat, lon and full address with Where Am I"
I am Rich,I am Rich : The most Expensive App | Rich Man App | Finance | Business | Money
Where Am I? GPS Loc,"Where Am I? My GPS location, Track it, share it, copy it your GPS location"
I am Millionaire - Richest guy in the town,Become a billionaire tycoon in a life simulator! Do life choices & get the money
Coast To Coast AM Insider,"Listen to Coast to Coast AM 24/7, download podcasts, preview shows and more"
I AM RICH PRO PLUS,I am Rich : The most Expensive App | Rich Man App | Finance | Business | Money
Where Am I?,"View your current location details using ""Where Am I"" application."
I Am Wizard,"Use your magic, control the battle and win the game."
What Am I? - Brain Teasers,"The chart topping, ridiculously fun iPhone word game now on Android!"
Who am I? (Biblical),Test your Biblical knowledge having fun in this incredible game of questions
DWWW 774 Ultimate AM Radio,"Music, News & Sports Radio Tuner App. Tune in Live FM & AM Radio Stations."
Anno: Build an Empire,"Forge Bowl is here! Strategy, simulation & building an empire through the ages!"
Vikings: an Archer's Journey,A mix between an archery shooting game with vikings and an endless runner.
Trell: An app for Explorers | Best Wanderlust App,"Map & organize your road trip and travel itinerary: TripIt, Roadtrippers in 1"
Virtual Families 2,There is a world in your computer. Adopt a little person and start a family!
My Emma :),Play this virtual pet pregnant game and take care of Pregnant Talking Cat Emma!
League of Gamers - Be an E-Sports Legend!,Defeat the noobs an esports streamer Legend on this idle clicker battle game!
Draw a Stickman: EPIC Free,"Draw a stickman, then guide him through a fantastic world of adventure!"
My Horse,Download My Horse now to look after your very own horse!
My Boo - Your Virtual Pet Game,Let's take care of a pets? Have fun with Boo: mini games with a cute virtual pet
Create apps fast with beautiful design and no code,"Create and build a mobile app for your business, organization, project or event"
THE KING OF FIGHTERS-A 2012(F),"Popular 2D VS fighting game ""THE KING OF FIGHTERS-A 2012"""
Diary with lock password,Create your own personal DIARY with lock.
Fast like a Fox,AD-FREE! 2016 Google Play Awards nominee: Standout Indie and Most Innovative
Scoompa Video - Slideshow Maker and Video Editor,Create beautiful videos from your photos and videos
Girls Craft: Exploration,Building & crafting game for girls! Craft & mine Exploration blocky world
The PCH App,"Want To Win A $15,000,000.00 Prize of a Lifetime! Get 10X ENTRIES EVERYDAY!"
Legend - Animate Text in Video,Make your life story with Animated Text-text animation intro maker.
"Resume Builder Free, 5 Minute CV Maker & Templates","Resume builder & CV Maker in PDF format. Make resume in 2 min for job, templates"
AO Surgery Reference,AO recommendations at your fingertips
ao,AO recommendations at your fingertips
AO/OTA Fracture Classification,Tool for classifying fractures
AO Player,AO Player App
Ao Oni2,"A big hit horror game ""Ao Oni2"" came back. That ""blue"" scourge begins again ..."
A. O. Smith,The official app for all things A. O. Smith
AO-EVENT,Official app for AO-EVENT
Arena of Valor: 5v5 Arena Game,The Arena for Everyone
PlacarTv Futebol Ao Vivo,PlacarTV is an app for football lovers
Virtual lover,Virtual romance & love story. Interactive chat game. Real love simulator & drama
The Hunt for the Lost Treasure,"Explore the island, find clues, and solve puzzles left behind by pirates."
Attack the Light,"Team up as Garnet, Amethyst, Pearl, and Steven for a magical RPG adventure!"
Princess Closet : Otome games free dating sim,Can get more hearts by just watching ads! Love story/Romance games for girls♡
Gravidez ao Vivo,Follow every second the development of your baby.
PES 2018 PRO EVOLUTION SOCCER,Updated license data for the 22-23 season.
Mobile Legends: Bang Bang,Play the 5v5 MOBA game on mobile with players worldwide.
Heroes of Order & Chaos,Fantasy heroes on the road to redemption. MMORPG game.
Kill Shot Bravo: Sniper FPS,FPS online multiplayer PVP Sniper gun shooter games & array of army maps & modes
Tennis Champion 3D - Online Sports Game,"Real 3D Physics, Swipe Controls and Online Multiplayer make this the Best Tennis"
Carnivores: Dinosaur Hunter,Open and explore a huge 3D world inhabited by variety of dinos.
High School Simulator 2017,Sequel of High School Simulator GirlA
Hopeless Land: Fight for Survival,Aim hopelessly landing enemies on borderland shoot rocket in Shooting land games
SofaScore Live Score,"Live scores app for all football scores, sports results, leagues and stats"
Virtual Cigarette Smoking (prank),Now you can smoke cigarettes wherever you want! Virtual tobacco is here!
Scanning body and undressing people,Apply pretty body filter for your photos and turn you into sexy guy or girl!
Ultimate Tennis,Play the complete tennis game (Sport game)! * Real-time Multi-player available *
Legion of Heroes,EMBARK ON A JOURNEY OF MAGIC AND FANTASY
Soccer Star 2018 Top Leagues · MLS Soccer Games,Soccer games full of stars! Be THE ONE and win the league!
Heroes Arena,Fair and fun MOBA action on the go
virtual lover 3D,Virtual romance & love story. Interactive chat game. Real love simulator & drama
Range Master: Sniper Academy,The best ONLINE MULTIPLAYER SHOOTING RANGE experience.
FC Barcelona Official App,The official Barça app for true fans. Now with Barça TV+ included!
Can Your Pet? : Returns - Teen,Can Your Pet is Cute Chick twist ending game Your cute pet is waiting for you
GUYZ - Gay Chat & Gay Dating,"Gay Dating Made Easy. Find Love, Match, Meet & Chat With LGBTQ Men Near You"
Bubbu – My Virtual Pet,Play cute virtual pet games with my cat. Take care of a pet in fun kitty games!
3D Tennis,Welcome to the most authentic 3D tennis game on Google Play.
Start the Hunt for the Lost Treasure,"Explore the island, find clues, and solve puzzles left behind by pirates."
Treasure Hunt Hidden Objects Adventure Game,Free hidden object game for adults. Find the hidden objects & treasure puzzles.
Scanning under clothes (prank),Body Scanner is just a prank scanner Xray simulator app used for fun.
WGT Golf Game by Topgolf,#1 golf game by Topgolf
3D Holograms Joke,simulator game where you can play on your phone like a 3-d hologram of a cats
Weaphones™ Gun Sim Free Vol 1,Weaphones is the ultimate firearms simulator for your phone or tablet.
Hidden Objects Treasure Hunt Adventure Games,Free hidden object game for adults. Find the hidden objects & treasure puzzles.
Live Camera Viewer ★ World Webcam & IP Cam Streams,See The World LIVE - Presented by EarthCam!
Body scanner (prank),Body Scanner is just a prank scanner Xray simulator app used for fun.
AP ENPS Mobile,"AP ENPS Mobile: take your newsroom with you, wherever news happens."
AP® Guide,Stay informed. Get all your global to local news with AP News!
WiFi Access Point (hotspot),"Turn on portable wifi hotspot, broadcast 3G/4G/5G data on mobile without tether"
AP Mobile,Stay informed. Get all your global to local news with AP News!
AP Manager,AP Manager
AP App for Android™,Stay informed. Get all your global to local news with AP News!
Access Point Finder,Optimize your WiFi network using WiFi Analyzer (open-source)
AP English Language: Practice Tests and Flashcards,"The top study app for flashcards, languages and learning"
AP Mobile 104,Stay informed. Get all your global to local news with AP News!
AP Planner,A daily organizer app to sync with google calendar and supports tasks & notes.
Access Point Browser,"Show info about near WiFi networks, SIMs and much more!"
AP Installer,APK Installer - the better app manager for Android.
Access Point Proximity,This app will allow you to find physical location of access points around you.
Study AP World History,"Summaries, questions, and terms. An easier way to study the textbook."
UniFi,The UniFi app simplifies home and business IT.
Ap Video Downloader for fb New 2018,Download video & story from Facebook: FB Video Downloader & Facebook Story Saver
AP Government Review,AP Government Review - a quiz-based application designed to help students learn!
"ap,wifi testing,iperf,ping,android,Bluetooth,tcp",PingTools - a simple but powerful set of network utilities.
HotSpot Tethering Free/WiFi AP,Easy way to turn your mobile to portable wifi hotspot by this hotspot app
AP Chemistry Prep: Practice Tests and Flashcards,"AP Chemistry full-length, timed practice tests, diagnostic exams, and flashcards"
AP Flashcards,"The top study app for flashcards, languages and learning"
AP World History: Practice Tests and Flashcards,"AP World History full-length practice tests, diagnostic exams, and flashcards"
Access Point Names,Brings up the Add APN page directly without going through settings
"AP Biology Prep: Practice Tests, Flashcards","AP Biology full-length, timed practice tests, diagnostic exams, and flashcards"
AP Biology Study Guide + Quiz,Biology quiz app can help you study better with questions and answers as a guide
500 AP World History Questions,"AP World History full-length practice tests, diagnostic exams, and flashcards"
AP Themes for Kustom/KLWP,"Pratical and unique free KLWP presets. You need ""KLWP Pro""(Paid)"
AP Physics 1 Prep: Practice Tests and Flashcards,"AP Physics Mechanics full-length practice tests, diagnostic exams, & flashcards"
Fate GO Ap Counter,This is a story about taking back our future! Who's ready for Fate/Grand Order?!
iScore5 AP Psych,iScore5™ is a test prep app to get students ready for the AP Psych exam
Glanceable Ap Watch Face,The ultimate watch face customization platform for smartwatches
AP Psychology Prep: Practice Tests and Flashcards,"AP Psychology full-length, timed practice tests, diagnostic exams, & flashcards"
meStudying: AP English Lit,"AP English Literature full-length practice tests, diagnostic exams, & flashcards"
APN Settings,Global database of APN Settings for almost all mobile operators
AEE AP,This is a tool for AEE SPARROW2
AP Math & Computer Science,"AP Math & Computer Science, Free for all"
AP Series Solution Pro,Mathway helps you solve your most difficult math homework problems
AP Statistics Prep: Practice Tests and Flashcards,"AP Statistics full-length, timed practice tests, diagnostic exams, & flashcards"
eChallan Andhra Pradesh (AP),This app is very use full for all citizens in India and also others
AP Art History Flashcards,AP Art History Flashcards - Study for 2016 AP Art History Test
True Skate,The ultimate skateboarding sim
AP European History: Practice Tests and Flashcards,"AP European History full-length practice tests, diagnostic exams, & flashcards"
AdventureQuest 3D MMO,"Battle on! A unique 3D massively multiplayer role-playing game, now with PvP."
AdventureQuest Dragons,"Battle Gems is the most epic, over-the-top, gem battle puzzle game... with puns."
AQ: First Contact,Create you perfect fleet and crush your enemies in this real time strategy game.
Battle Gems (AdventureQuest),"Battle Gems is the most epic, over-the-top, gem battle puzzle game... with puns."
Undead Assault,"Customize your hero, gear, and guns then team up to eradicate the zombie hordes!"
AQ Service,Turn your everyday shopping experiences into cash!
AQ wisdom +,AQ Wisdom + is a mobile-side application that connects sweeping robot products.
AQ SMS Notify,"Simple, helpful messaging by Google"
AQ Math Facts,"Cool Fun Games for 7, 8, 9 year old girls and boys - first, second, third grade"
Adventure Quest World Mobile Quiz,"Battle on! A unique 3D massively multiplayer role-playing game, now with PvP."
Aqw&3d Design Notes Manager,"GoodNotes, Good Notes Writer, Notebook, Notepad,Memo,Sticky Notes Widget, Noteit"
AQ Aspergers Test,Evaluate your risk of Autism Spectrum Disorder with a validated screening test.
Guess the Class 🔥 AQW,"Crack trivia to test iq level in quiz games, show texting skills in word games🤳"
AQ Ria Retail,"Send money internationally. Fast, reliable, trusted money transfer for 35 years."
Accounting Quiz (AQ) Malaysia,AccQuiz is a free accounting quiz and includes flash cards to study the quiz.
AQ Guards,Protect Mr. President from bullets! Become a human shield in this shooting game
Wowkwis aq Ka'qaquj,Mi'kmaw Storybook
AQ Coach,Help volunteer coaches prepare and deliver great practices
AQ Dentals,An interactive dental education platform for students
中国語 AQリスニング,Free App for CHINESE self-learners
ClanHQ,"Find teammates & meet game friends to play together. LFG - squad up, chat, play!"
QuickShortcutMaker,"Quick shortcut maker could quick launch flashlight, screen lock, volume, app etc"
Iron Blade,"Medieval RPG game with demons, darkness and war. Make a hero and grab the sword"
QR Droid,"QR Droid™ - a full-featured, multi-language QR utility now compatible with Wear!"
QR BARCODE SCANNER,The fastest QR code reader and Barcode scanner.
Dungeon Boss – Strategy RPG,"⚔️ Collect heroes, battle awesome bosses, and raid in an epic RPG fantasy world"
Questland: Turn Based RPG,"Role-playing game online. Fight monsters, level up & complete hero quests!"
Order & Chaos 2: 3D MMO RPG,Fantasy heroes on the road to redemption. MMORPG game.
Dungeon Quest,A free and offline Action Role Playing Game.
Dungeon Hunter 5 – Action RPG,PvP adventure game with rising heroes to grab the sword and claim power
"Grow Stone Online : 2d pixel RPG, MMORPG game","3 Million user choices! Do RPG, Dungeon, Battle, PVP now! So addictive game"
Evil Apples: A Dirty Card Game,Play cards against your friends
Megatramp - a Story of Success!,"Determine the sim lifestyle from poor to rich. Get job, make company and family!"
Knightfall™ AR,"An augmented-reality experience based on History™’s newest series, Knightfall."
Ghost Snap AR Horror Survival,Feel the fear in the ultimate FNAF Augmented Reality nightmare!
The Walking Dead: Our World,AMC’s Official The Walking Dead Zombie Survival turn-based RPG !
Snaappy – 3D fun AR core communication platform,We have invented a new way for people to communicate and socialize based on AR.
Sketchfab,"Millions of models from our community in 3D, AR, and VR on your mobile device."
Ingress,Install Ingress and transform your world. Our future is at stake. Choose a side.
My Tamagotchi Forever,The classic virtual toy! It is time to try the original pet simulator
"Egg, Inc.",Build an enormous egg farm!
Flat Pack,Flat Pack. A 2D and 3D platform mix-up!
Crayola Color Blaster,Turn photos into coloring pages to print and color!
Guns of Boom - Online Shooter,Team-based PvP action with super easy controls. Get ready for battle!
Guns Royale - Multiplayer Blocky Battle Royale,The ultimate online PvP battle royale for mobile - Now with AR mode!
Build.com - Shop Home Improvement & Expert Advice,Everything you need for your home improvement project is just a tap away.
Wayfair - Shop All Things Home,"Furniture, Décor & Design Tips"
Stack It AR,Stack the blocks AR version - Build a virtual tower on a real world surface 🏆
"ARuler - AR Ruler app, Measure tools","Room measurement, AR Ruler, Tape measure distance, Floor plan, Scan, Home design"
SNOW - AR Camera,Make every moment special with SNOW
Monster Park AR - Jurassic Dinosaurs in Real World,Walking with 4D dinosaurs and other creatures in augmented reality everywhere!
AR Remote Car,https://www.akillimum.net/
Solar System AR ( ARCore ),Travel in the Solar System with Augmented Reality!
Super AR,"Come on , join the magic family and fight with us!"
Spacecraft AR,Check out some of NASA’s robotic explorers through stunning augmented reality.
Assemblr - Create 3D Models (Sandbox AR),"Easy augmented reality creator. Premade AR templates. 3D objects, image, & video"
MCRAFT AR - EDITOR,Bring your creativity to the real world.
Jenga® AR,"Remove blocks from the tower, but when will it fall ?"
Nightenfell: Shared AR,"An augmented-reality experience based on History™’s newest series, Knightfall."
Portal AR - Step Into Scotland,80's AR Portal is a simple app that help you to travel into a 80's style world!
Arcraft - AR Sandbox,Build your own world with Augmented Reality!
Augment - 3D Augmented Reality,Visualize 3D models in Augmented Reality.
Satellite AR,Set up satellite dish and find tv satellites with AR Satfinder Dish Pointer
Figment AR,"Create, record and share imaginative scenes around your world using Figment AR."
AR Tank Battle,AR Tank Wars is the most addictive Augmented Reality War game ever.
AR Dragon Pet,Augmented Reality Virtual Pet Simulator!
Paint Space AR,"Paint Space AR lets you paint in midair, add special effects, photos, and more!"
"Just a Line - Draw Anywhere, with AR",Want to experience your 2d art in 3d? Install Draw It an Augmented reality app.
AR Toybox - Augmented Reality Demos,A demonstration of augmented reality games on Android phones
"Mind Map AR, Augmented Reality ARCore Mind Mapping","Nice Mind Map helps you capture every moment of inspiration, manage mindmap"
【Miku AR Camera】Mikuture,Mikuture is a AR app synthesis of Miku made by the secondary creation.
AR Toys: Playground Sandbox | Remote Car,Augmented reality (AR) toys simulator. Choose your remote controlled car!
Summer Camp Island AR,Play tons of games and collect your favorite Cartoon Network characters!
AR Sport Cars,Drive real cars using Augmented Reality in the real world from your phone
AS - News and sports results.,"Get NFL football scores & sports news on Baseball, Golf, Soccer, MMA, F1 & more."
MARCA - Diario Líder Deportivo,"All sports information, live football scores and other sports."
"AS - Diario online deportivo. Fútbol, motor y más","Breaking news, results and rankings of the sport live"
SleepCloud Backup for Sleep as Android,"Your data safe in SleepCloud, on all your devices.Compare your sleep with others"
AS Guía de las Ligas 2017-2018,"Soccer results, goals, line-ups, highlights, signings and news"
Sleep as Android Unlock,Track your sleep and wake up gently with nature sounds in optimal sleep phase
Sleep as Android Gear Addon,Track your sleep cycle and wake up gently with nature sounds in optimal phase
Sleep as Android Garmin Addon,Addon for Sleep As Android for sleep tracking with Garmin Connect IQ watches
"Sleep as Android: Sleep cycle tracker, smart alarm",Track your sleep cycle and wake up gently with nature sounds in optimal phase
Sonic the Hedgehog™ Classic,SEGA's platform hit returns with Sonic The Hedgehog on mobile!
The Aether: Life as a God,"Rule over your mortal race, explore the Aether, and become an omnipotent god."
CAPTCHA Pack for Sleep as Android,Official CAPTCHA Pack for Sleep as Android.
Pacific Navy Fighter C.E. (AS),Naval carrier air combat in world-war 2 pacific command+fly bombers & fighters.
Lullaby Add-on for Sleep as Android,Track your sleep cycle and wake up gently with nature sounds in optimal phase
Sleep as Microsoft Band Add-On,Track your sleep cycle and wake up gently with nature sounds in optimal phase
Ear Agent: Super Hearing,Ear Scout amplifies sound from the microphone to your headphones
Ninja Turtles: Legends,Help Leonardo as he takes on the Kraang to save his brothers and fellow mutants!
Timely Alarm Clock,Timely Alarm Clock contains all the features complete clock application.
PDF Viewer & Book Reader,"PDF Viewer & Document Reader: Best way to download, read & edit PDFs / documents"
My OldBoy! Free - GBC Emulator,"A fast, full-featured GB/GBC emulator with link cable emulation."
My Boy! Free - GBA Emulator,"A fast, full-featured GBA emulator with link cable emulation."
Samsung Health,"Lifestyle companion to track your fitness, weight, diet, food & sleep."
WiFi Baby Monitor - NannyCam,The most reliable baby monitor with intelligent features and unlimited range
Maleficent Free Fall,Experience a dark and exhilarating match 3 adventure in Maleficent Free Fall!
Star Wars™: Force Arena,May the Force be With You! Unlock & battle with your favorite Star Wars™ heroes.
