App,Descriptions
CY.SEND Online Top Up,"Get the world's favourite mobile recharge app and top-up any phone, anywhere."
ABTO CY-ET1,Become Ryan from Ryan's World and see how far you can go!
CY:ME - real time gps tracker,Popular gps tracker. Show your location in real-time.
Alpha Bank CY,Alpha Mobile Banking comes always updated. Login by using PIN or Fingerprint.
Cy Messenger,"Free group video chat, video calls, voice calls and text messaging."
Amadeus GR & CY,Amadeus Direct - exclusive workspace for small and medium (SME) travel agencies.
Igitabo cy'Indirimbo,Indirimbo zo gushimisha Imana n'izagakiza
Doctor Finder CY,Doctors & dentists online + in your area - book a same day appointment
Eshopcy.com.cy,Instant access to your favorite online shop whenever and wherever you want.
NOMISMA.com.cy by FMW,"Create invoices, manage expenses & view your small business finances with ease."
Cy-Fair VFD EMS Protocols,Efficient documentation of med. emergency situations and rescue missions - ePCR
EUROBANK CY,EUROBANK CY
Cy-Fair Christian Church,Download the CFCC app to help you connect with Christ and other believers.
Mediabox CY,The box of world entertainment
Capitalnews.com.cy,Reconnect with your neighborhood! Daily news alerts for local news headlines!
Shadowverse CCG,Four million battles every day. One Shadowverse. Japan's #1 strategic card game.
CY Digital Net,Connect with NET Digital + in an efficient and transparent manner
Cy-Fair Houston Chamber,"Now enabled for Mobile Check Deposit! Deposit checks anytime, anywhere!"
StudentLife.com.cy,"StudentLife services, a Student Support Program through Empathia"
Phone Clean Best Speed Booster,Keeps your Phone fast & clean up junk files & One-Tap to boost & Cache Clean
VAT check CY,The easiest way to verify Customer's European VAT numbers validity.
Cy's Elma Pharmacy,Easy-to-use refill application!
CY Spray nozzle,Gazeeka Spray Nozzle App - Select the right nozzle for agricultural spraying
LOCX Applock Lock Apps & Photo,"App Lock can lock Apps, hide Photos and AppLocker supports fingerprint unlock"
Cymath - Math Problem Solver,"Enter your math problem, and let Cymath solve it for you step-by-step!"
Rewards,Answer surveys and earn Play credit!
Army of Heroes,Take command in World War II.
BibleRead En Cy Zh Yue,"Bible in English, Welsh, Simplified Chinese, and Cantonese"
Math Solver,Get math. Get Photomath.
SuperBikers 2,"Did you like ""SuperBikers""? You will love ""SuperBikers 2""!"
Cyprus Bus Companion,Real time Public Transport Passenger Information in Cyprus
Cyprus Police,Cyprus Police - Immediate and timely information to the citizens.
foody Cyprus - online ordering,Foody is the # 1 app for delivery in Cyprus!
Death Dragon Knights RPG,Collect unique pets and weapons and battle epic bosses to become the Hero!
Bank Of Cyprus,"Use our new app for your banking on the go. It’s easy, fast and free."
Map of Cyprus offline,Offline map of Cyprus. Works without connecting to the Internet.
McDelivery Cyprus,"Order, Deals & Rewards"
CZ-USA,Claim your invoice in a few simple steps
CZ File Manager,File manager app with clean interface to provide easier management of files
Security Camera CZ,Turn your old smartphone into online monitoring camera.
Šmelina .cz inzeráty inzerce,Internet classifieds for everyone. Bazaar where you can easily sell everything.
Alzashop.com,Shop all at Alzashop.com
KFC CZ,"Enjoy Kentucky Fried Chicken - Order from Full KFC Menu - Meals, Deals & Offers!"
Skylink Live TV CZ,The Skylink Live TV you can now watch your favorite shows
CZ-70 (CZ-50) pistol explained,CZ-70 (CZ-50) pistol explained
CZ-52 pistol explained,CZ-52 pistol explained
CZ-27 pistol explained,CZ-27 pistol explained
Online TV CZ/SK PRO,Watch live streaming of Czech and Slovak television channels
Rande.cz,"Meet people, new friends and love, first even without seeing each other's face."
Breweries (CZ/SK),Find nearby craft breweries & join beer enthusiasts community. Best breweries
reality.cz,reality.cz - real estate search application for properties in Czech Republic
CZ-45 pistol explained,CZ-45 pistol explained
CZ-Help,Appendix - an indispensable tool for all those who study the Czech language
Hlášenírozhlasu.cz,An application that effectively communicates and communicates with citizens of towns and cities.
signály.cz,Check your 4G/5G/Wifi Signal strength or speed at your home/office
CZ-Cyberon Voice Commander,Provides accessibility by voice for hands-free mobile computing.
Pistolet CZ-70 CZ-50 expliqué,Detailed explanation of the mechanism and operation
CZ-38 (vz 38) pistol explained,CZ-38 (vz 38) pistol explained
HTC Sense Input - CZ,Download this add-on to improve word prediction in your language.
WebCams,See The World LIVE - Presented by EarthCam!
Wallpapers CZ 75 85,Offline and free wallpapers
SMS Sender - sluzba.cz,send one message to unlimited user's in a single click
Novinky.cz,"Current news and articles from magazinov Novinky.cz quickly, anywhere."
Wallpaper.cz,"Millions of free background wallpapers, ringtones, alarm & notification sounds"
Strava.cz,Strava for Android allows you to order food on the portal strava.cz or strava.sk
CZ Kompas,"Information on migraine, advice, diary of a patient with a headache, treatment reminder."
Modlitební knížka CZ,All the books you love. On the page or out loud. Anywhere you are.
Reksio cz. 1,The official mobile game of TheOdd1sOut!
MYTO CZ,Official application for ETS in the CR
PLAYzone.cz,PLAYzone application for scanning codes.
Tools & Mi Band,Fully customizable notifications for your Xiaomi Mi Band smart bracelet.
RoutePlan.cz,The application is used for planning trips.
TeeTime.cz,Useful application for all the golfers.
What is my IP address,This app will give you information about your current IP (+IPv6) address.
Windguru Lite,"""Lite"" app to access wind forecasts from windguru.cz, not maintained anymore..."
Vira.cz Widget,Get the Biblical quote of the day and topic of the week from http://www.vira.cz
Da Fit,"Use Da Fit Band to set, track, and follow your health data day and night."
The House of Da Vinci,"Solve mechanical puzzles, discover hidden objects & escape from rooms. Play now!"
Dan the Man: Action Platformer,Do you like action and platform games? this is your game
Ghost Detector,The ultimate ghost detector with communicator & paranormal activity radar!
Master for Minecraft(Pocket Edition)-Mod Launcher,"MCPE Master Game Minecraft: Mods, Maps, Servers, Skins, Addons, Textures."
King of Math,Level up your mathematics skills and become King of Math!
Translate: text & voice translator,"Translate text, voice, images, and conversations into 70+ languages"
The Zueira's Voice,"Accurate Text to Speech Converter - Daniel (MLG), Loquendo, TTS Voiceover!"
Battery Calibration,The easiest way to calibrate the battery of your device.
FVD - Free Video Downloader,"FVD is a Video Downloader App from which you can download Private,Public Videos."
Thuglife Video Maker,Make your own Thuglife videos!
MadLipz,Make hilarious bite-sized parodies (Lipz) and share them with everyone!
Soccer FC,Soccer games full of stars! Be THE ONE and win the league!
Visage Lab – face retouch,Retouch your portrait in a click and apply impressive filters and photo effects!
Geometry Dash SubZero,Jump and fly your way through danger in this rythm-based action platformer!
Escaping the Prison,"Use everything to escape! Teleporters, anti-gravity equipment,toilet plungers..."
Quiz TRUE or FALSE,Test your knowledge in super game True Or False!
Glam Doll Salon - Chic Fashion,Be a CHIC DARLING and LOOK PERFECT everyday in Glam Doll Salon!
Siren Ringtones,"The loudest, most attention grabbing ringtone app on the market!"
Peppa Pig: Party Time,Peppa and her friends are having a party and they want you to join them!
Download Manager for Android,ADM intercepts files from browsers and accelerates downloading by several times.
The Visitor,Visit from Anywhere On your Android device
Just Dance Now,Unleash your inner dancer with Just Dance Now!
DB Navigator,"Tickets, real-time information and coach sequence"
SQLite DB Reader,Open and edit your SQLite databases
DB Browser,"Must have app with features of browser, downloader, file manager, proxy etc"
Sound Meter,Measure the environmental noise by tidy sound meter
db.Mobil App,Data are recorded in the barn and then transferred to the office db.Planer.
DB Streckenagent,DB's line agent app
dB: Sound Meter Pro,Measure the environmental noise by tidy sound meter
Movie DB,"Top rated, Popular, Now Playing and Upcoming movies information app"
dB Sound Level Meter,Measure the environmental noise by tidy sound meter
DB Sound Meter: Measure Noise Level- Decibel Meter,Measure the environmental noise by tidy sound meter
DB Welt - Die Zeitung der DB,"Tickets, real-time information and coach sequence"
Check DB Benchmark,Find out how fast your Android device is with Geekbench 5.
ACCDB MDB DB Manager Pro - Editor for MS Access,View MS Access DB file (ACCDB - MDB - DB)Open Table Data Paging Filtering Sort
Scale Models DB,Experience and share your SolidWorks designs on your Android® phone and tablet.
DB Train Simulator,Become a real train driver and save energy while staying on schedule.
DB Tools,Add functional dependencies. DB Tools will do the rest.
dB Meter - measure sound & noise level in Decibel,Measure the environmental noise by tidy sound meter
DB LINK RGB,The DB LINK RGB app is an intelligent RGB LED control。
DB BAHN,"Tickets, real-time information and coach sequence"
DB Manager,View and edit SQLite database on your Android device.
"10,000 Quotes DB (Premium)","Guided meditations, motivational quote images, articles, breathing exercises."
Guide for DB Xenoverse,Summon your favorite DRAGON BALL characters for battle in this anime action game
DB Transport,"This app provides information about Discovery Bay ferry, buses and Club coaches."
DB Stay Connected,This Deutsche Bank app will inform and update you throughout your programme.
DB FahrtProfi,Summon your favorite DRAGON BALL characters for battle in this anime action game
DB TOS - Pocket Helper,Your TOS mobile guide
ReDNAKET DB Normalization Tool,Relational Database Normalization And Key Extraction Tool - 3NF and BCNF
Guide for DB Xenoverse 2,Summon your favorite DRAGON BALL characters for battle in this anime action game
DB Customer Connect,App for Dainik Bhaksar's Customer
Patron DB,Client for MySQL and PostgreSQL.
DB Event App,The official Life Fitness DB Event 2020 event-app
DB HOME,Summon your favorite DRAGON BALL characters for battle in this anime action game
Bowers & Wilkins DB Subwoofers,This app helps you set up and control your Bowers & Wilkins DB Series subwoofer.
Guide for IMS DB,Easy tutorial offline to learn IMS DB everywhere
DB Busradar NRW,Is my bus on time? Real-time information about the buses of DB Regio NRW Bus
DB Pickles,"The app lets you connect with this restaurant, bar, deli, bakery and pickle bar."
DB for Fallout Shelter,Fallout Shelter puts you in control of a state-of-the-art underground Vault.
LC-DB,Summon your favorite DRAGON BALL characters for battle in this anime action game
dB Sound Meter,Measure the environmental noise by tidy sound meter
DB for Hustle Castle,"Rise of medieval castle games: raid story by mighty kings, knights and kingdoms!"
DB Ultra Saiyan Battle,Play the ultimate fusion warrior of legendary rise of ultra instinct
Preferences Manager and SQLite DB Viewer,it allows you to edit application's preferences and View SQLite DB Files
LC-DB-LITE,Open and edit your SQLite databases
db Meter - sound level meter with data logging,"Measure decibels & noise level meter (dba, decibel) with audio spectrum analyzer"
Hamburg Transit - Offline HVV DB times and plans,"Departures timetable for S-Bahn, U-Bahn, Tram, Bus, Ferry from HVV, DB and more!"
SW-DB,A global RPG that mesmerized users worldwide!Win battles with unique decks!
DC Legends: Battle for Justice,"Battle Batman, Flash, Joker & Many More Heroes in the Ultimate Fight for Justice"
Injustice 2,Experience Action-Packed Fighting with Powerful DC Super Heroes & Super-Villains
Injustice: Gods Among Us,Build an epic roster of DC heroes and villains and get ready for battle!
FANDOM for: DC,"All the stories that matter about the shows, movies, and games you care about."
LEGO Batman: DC Super Heroes,Legends Unite!
Ultimate DC Challenge,Experience the largest selection of DC comics anywhere with DC UNIVERSE INFINITE
LEGO® DC Mighty Micros,Legends Unite!
Justice League Action Run,"Battle Batman, Flash, Joker & Many More Heroes in the Ultimate Fight for Justice"
Marvel and DC Wallpapers,Suprerheros Wallpapers provide you an amazing collection of wallpapers for you
DC Comics Amino,"Find your fandom, discover anime & manga, chat, & roleplay with friends on Amino"
Comics,"Read comics, manga & manhwa"
Quiz DC,DC Comics Character Quiz 2021 - Fun Trivia Game
Batman: Gotham’s Most Wanted!,Bruce Wayne and Batman will be forced into precarious new roles.
"Superheroes, Marvel, DC, Comics, TV, Movies News","Instant access to over 30,000 Marvel comics with new issues added every week."
Choose SuperHero Quize Marvel | DC,Guess the Superheroes Name is for all MCU Superheroes fan to test their skills.
MARVEL Avengers Academy,Indian Avangers Academy app for students
DC Universe Quiz,DC Comics Character Quiz 2021 - Fun Trivia Game
DC HSEMA,Emergency! Download the HSEMA App for when you need to know! tablet or phone.
DC Universe Online Map,Experience the largest selection of DC comics anywhere with DC UNIVERSE INFINITE
DC Public Library,Access DC Public Library from your Android phone or tablet.
Vote 4 DC,Discover what it takes to become an informed voter with Cast Your Vote!
Villains vs Superheroes,Tap into the Super within you in an epic DC Puzzle RPG super hero game!
DC Rider,The ultimate transit app for DC Metro and bus.
Power Rangers: Legacy Wars,Experience the Power and become part of the Legacy. It’s Morphin Time!
MARVEL Future Fight,"Assemble the Avengers, X-Men, Guardians, and other heroes to save the Universe!"
DC Metro Transit - Free,"Realtime predictions for Washington DC MetroRail, MetroBus and other local buses"
DC N COMPANY ENTERTAINMENT RADIO!,Plays DC N COMPANY ENTERTAINMENT RADIO!
Results for DC Lottery,"Lottery results for Powerball, Mega Millions and DC lottery games"
FOX 5 DC,"Washington, D.C. news, weather, traffic and sports serving Maryland and Virginia"
Pepsi Cards DC,Unlock the DC Multiverse with Hro Hybrid NFT Trading Cards
Driver Permit Test Prep DC DMV Driver's License Ed,"DMV Permit Practice Test, Drivers License Learners Prep & CDL App for all states"
Robin - DC Movie Collection,Full Movies is a lite movies app to watch online & browse related content.
DC-014,Drocon Fly is a APP for the four axis aircraft control via WiFi protocol.
D.C. Driving/Walking Tours,Experience a self- guided tour of the national monuments and memorials
Painting Lulu DC Super Friends,Adult Coloring Book Paint by Number Color by Number. Relax and Fun.
DC Metro,The ultimate transit app for DC Metro and bus.
DC Trails-Hop On Hop Off Tours,DC Trails app serves as your personal companion and tour-guide as you journey.
DC Metro Transit,"Realtime predictions for Washington DC MetroRail, MetroBus and other local buses"
AC DC Power Monitor,Synopsis of DC-to-AC power converter circuit for electronics engineering.
McClatchy DC Bureau,Stay up to date with all the national news.
AutoScout24 - used car finder,"Find over 1 million new & used cars, vans or motorcycles"
WEB.DE Mail,All your e-mails at your fingertips
Your Freedom VPN Client,"Multi-protocol tunneling, anonymization and anti-censorship solution"
Dictionary,America's most useful and respected dictionary.
Bokeh (Background defocus),Create amazing blur background effect photos like a Professional DSLR Camera
Speed Camera Radar,Get GPS speed camera detector in your smartphone!
WDAMAGE: Car Crash Engine,Extreme car crash simulator!
Coloring Book for Me & Mandala,Hey! Interesting art game: Coloring book with mandalas and animals for adult
APUS File Manager (Explorer),Full-featured file manager with super-fast file transfer among Android and PC
Offroad Police Car DE,"Become a policeman, hop into the luxury police car and chase criminals."
Easy Language Translator,Translate text and speech to many languages. Fast and easy.
Word Search multilingual,Find the hidden words!
Love Collage - Photo Editor,"Collage maker with Heart Photo Frames, Photo Grids, Stickers, Effects and more!"
Heavy Bus Simulator,Download now! Be the best Bus driver! From creators of Heavy Truck Simulator
Love Fonts for FlipFont,The best collection of love fonts with stylish keyboard and fonts resize feature
Piano Free - Keyboard with Magic Tiles Music Games,Simulator with Magic Keys
Escape the Prison Room,"Solve puzzles to escape, find a way out, escape room jail game, room scape game."
Bike Racing 3D,Bike Racing 3D is the most challenging BMX game with insane and stunt action!
Satellite Director,"Finding a TV satellite, in azimuth, is difficult. Satellite Director helps."
Truck Driver Cargo,Drive trucks through dangerous roads and deliver cargo
Anime Love Story Games: ✨Shadowtime✨,Take part in the exciting otome game that will leave you craving for sequels!
Checkers,Amazing graphics and very small app size
Scratch Logo Quiz. Challenging brain puzzle,"Bored? Do some scratches to find out the logo! Don't be bewildered, be calm."
Myth Defense 2: DF,"Myth Defense is back! No IAPs, complete game with all DLCs included! 40% off!"
df,DF Fitness App
DF Squid,"Take handwritten notes for class, work, or fun! Easily markup PDFs and share…"
Myth Defense 2: DF Platinum,"Myth Defense is back! No IAPs, complete game with all DLCs included! 40% off!"
DF 司機,"Fast & Simple PDF Viewer to view, read and manage PDF Documents"
DF@realtime,ADP Mobile Solutions is an employee self service app
DF Night Selfies,Take a selfie even in the worst light condition with DF Night Selfies!
DF Coaching,Welcome to DF Coaching!
Digital Falak,"Istiwak time(WIS), Prayer times, Hijri calendar, Qibla compass, Holidays, etc"
The Divine Feminine App: the DF App,Find Sacred Circles and Resources for Feminist Spirituality Sacred Mother Earth
Guide to Nikon Df,"With the SnapBridge app, downloading photos from Nikon cameras is easy."
DF BugMeNot,The Last Password you will ever need.
DF-CAM,"iWFCam is an APP designed for our Wi-Fi camera, Make it easy to use the camera"
DF Tracker,DF Tracker GPS Fleet Management System
Guia Bike DF,"Your cycling companion: Cycle route planner, bike computer & ride tracker"
Rádio DF FM,Application of radio Clube FM of Brasília-DF.
Noticias DF,Stay informed with latest world & local news personalized for your interest
DF Glue Board,A collaboration space worthy of your ideas
DF-Server Mobile,Intelligent document management.
DF-View,PDF Reader App to View & Manage Documents & PDF Files. PDF Viewer App.
"MexiRoomies - roomies, mexico, df, apt, house room","search for roommates, rooms for rent and room shares."
DF Wall Plus – Droid Firewall,"Firewall WITHOUT ROOT. Host name name filtering, fine-grained access control."
Diario Financiero,Financial newspaper leader in business information
Digital FM Brasília DF,Application of radio Clube FM of Brasília-DF.
DF SmartPlus,The Smart Intercom
Red Transporte DF,"Subway,Metrobus,Suburbano,Tren Ligero,Ecobici,Trolebus,Bus Terminal,Mexico,DF"
ElejaOnline DF,"Fill, sign & send docs, forms, agreements & contracts via electronic signature."
ProconLegis-DF,This APP can control the aircraft by WiFi of the Android smartphone.
Técnico Legislativo Câmara Legislativa DF,57 questions / feedback offline for CLDF TECNICO LEGISLATIVO 2019 pre-edital
Cargo de Praça PM DF,offline simulated with PMDF Soldier 2018 contest feedback
Consultar Infracciones de Transito DF y Mexico,"Consulta multas de tránsito, datos del vehiculo y conductor y mucho más."
Droidbug BusyBox Advance PRO,"The fastest, most trusted, and #1 BusyBox installer and uninstaller!"
México City D.F News,Reconnect with your neighborhood! Daily news alerts for local news headlines!
PDF Reader – PDF Editor 2018,"Open PDFs, fill out forms, sign contracts & more - all ad-free, no subscription."
Fix Error Google Playstore,Update your Google Play Services And Fix Google Play Store & Play Services Error
df-Vegetable,Field Force Tracking is a user friendly application
Aproveita DF,"Fast & Simple PDF Viewer to view, read and manage PDF Documents"
EVENTOS DF,"Find upcoming events and local things to do, buy tix and check-in on mobile."
Citymapper - Transit Navigation,Route Planner for City Navigation: MTA MBTA NJ Transit Bus Times & Subway Map
Rádio Sol Nascente DF,"Download our app and listen to our radio anytime, anywhere."
Diseño de columnas NTC - RSEE 2017,Design of concrete columns according to the NTC - RSEE 2021
"Dollar General - Digital Coupons, Ads And More","Shop and save with our smart, easy-to-use DG app."
DG Coupon,"Shop and save with our smart, easy-to-use DG app."
Penny Finder,Dollar Admiral is the ultimate penny item shopping tool for Dollar General.
DG - Digital Coupons - Free Coupon and Discount,"Shop and save with our smart, easy-to-use DG app."
DG Surveyor,"uPVC Double Glazed Windows & Doors Surveying, Measuring & Pricing in an instant."
DG Smart life,Connect Your Life
Krazy Coupon Lady,"promo codes, rebate, savings, grocery coupons, couponing, digital coupon, codes"
DG UPnP Player Free,"Cast all your music and videos to TV, DLNA, Chromecast, Hi-Fi, phone and more!"
Penny Puss,Penny Puss App with DG Penny Finder. Dollar General Penny List items and more.
DG Mobile,"Shop and save with our smart, easy-to-use DG app."
Go Go Coupons - Free Coupon and Discount,"Shop popular stores, find and apply coupons, and earn rewards."
ZombieVital DG,Dungeon Management Simulation Game
DJ Electro Mix Pad,"If you like DJ Electronic music, this is for you!"
DG Screen Recorder,Record your game play and activities and share with friends.
DG Report Reminder,"No Stress, Feel Relax It will remind you everything!! - Make life easier with us"
DG Video Editor,"Pro Video Editor with Music, Filter, Slideshow, Effect, Merge & Trim Video."
The DG Buddy,Smash and hit the buddy in our stress-relief game. Unlimited weapon arsenal.
Roland DG Mobile Panel,This is an application to remotely control our correspondence printer.
Destroy Gunners Σ,"This is the newest ""Destroy Gunners Series"" #5."
DG-App,"Shop and save with our smart, easy-to-use DG app."
Can I pack that? - DG App,Before you travel – make sure your luggage is safe.
DG Phone Call Task Switcher,"Reliable phone calls with spam protection, caller ID and more helpful features"
DG Fitness,Leading app for fitness professionals.
Sharaf DG,Electronics Shopping App. Enjoy deals & doorstep delivery on latest gadgets
DG Card,Search for Digimon Card Values from 1999-2021 from around the world.
Coupon Mob - Discount Coupons,"Unlock savings in-store & online, cheap fuel, freebies, & earn cash w/o receipts"
DG Users,"Shop and save with our smart, easy-to-use DG app."
DG Cars,Welcome to the DG Cars booking App!
Free coupons and vouchers,"Shop popular stores, find and apply coupons, and earn rewards."
DG Hair,Book and manage your appointments easily our mobile app.
DG Xplained,"Shop and save with our smart, easy-to-use DG app."
DG OFF - 100% Free Coupons & Deals,"Deals, Coupons, & Promo Codes: Save Money Easily"
Digoo·Cloud,"Store, share & backup files, photos, videos to secure 20 GB cloud storage."
DG Monitor,"Shop and save with our smart, easy-to-use DG app."
DG ग्राम / Digital Gram Panchayat,"e-Gram Panchayat, one app for all works, One app for all works"
DG TV,Android TV style launcher
Daily Horoscope,Daily Horoscope - the most popular horoscope application on Android!
DHgate-Shop Wholesale Prices,wholesale stores
DH Texas Poker - Texas Hold'em,Over 30M downloads Texas Hold'em Poker!
DEER HUNTER CLASSIC,The Ultimate HD Hunting Simulator on Android!
DEER HUNTER RELOADED,The Ultimate HD Hunting Simulator on Android!
DH Pineapple Poker OFC,The TOP OFC Pineapple Poker!
DH UFO,an app we can control a quadcoptor to fly with a wifi camera module
Galaxy Defense,Galaxy Defense - The best strategy/arcade tower defense ever!
Call of Mini™ Dino Hunter,"Fight with giant lizards by updating weapons,and win a victory to get loots!"
Castle Defense 2,Castle Defense 2: best strategy/arcade castle defense ever !
Dungeon Rush,Unique Strategy Role Playing Game! Form your heroes and battle for victory!
Bike Mayhem Free,Rip down tons of mountains while busting tricks on your custom bike!
Treasure Defense,"Treasure TD: A brand new take on strategic tower defense games, and endless fun"
Car Crash III Beam DH Real Damage Simulator 2018,A real race with good graphics in the genre of an accident game machine!
The Lost Lands:DH Lite,Wonderful beauty of pristine nature and its inhabitants are waiting for you.
DH-UFO,an app we can control a quadcoptor to fly with a wifi camera module
Daddyhunt: Gay Dating,"Meet, Chat and Date Daddies"
DH Karaoke,Speaker Karaoke Wifi Connection Application
Tiny Defense,"Build and upgrade your army, conquer and defend your lands!"
Toys Defense: Horror Land,"Free toys tower defense! Battle with octopus, caterpillars, cyclops & more! "
D-H Pharmacy,Enjoy the convenience of D-H Pharmacy App anywhere you go!
DEER HUNTER CHALLENGE,It’s Open Season - join the hunt today and bag the biggest game!
Kingdom in Chaos,Are You Ready? This isn't just a strategy game but also a base protection game.
Desperate Housewives: The Game,Play virtual happy mom and dad and be a great housewife in the life simulator.
Dinosaur War,"Dive into the crazy PVP action on dinosaurs, titans, and monsters!"
DH News,"Deccan Herald–My News (Personalised News), News Shots, Lite View, Breaking News"
Bike Unchained,Just send it!
