App,Descriptions
YouNow: Live Stream Video Chat,Watch & create interactive livestream videos and make friends
Mirrativ: Live Stream Any App,Anyone can be a game streamer with just 3 taps!
Nextdoor - Local neighborhood news & classifieds,"Local Neighborhood News App with Marketplace Near You (Furniture, Home, & More)"
"SKOUT - Meet, Chat, Go Live",Real People. Real Dates. Real Free.
Banjo,Application with which you will be able to tune your banjo quickly.
We Heart It,"Discover endless inspiration from photography and travel, to fashion and more!"
Timehop,Relive your memories every day
Frontback - Social Photos,"Easily resize and crop pictures, remove background, and edit with filters"
Path,The official PATH app created by The Port Authority of NY & NJ
Couple - Relationship App,"When the relationship becomes official, Between."
POF Free Dating App,"Plenty of Fish Dating app. Browse photos of singles, chat and date"
LOVOO,"Live matches, flirts, dating, and love – LOVOO, the dating app of the year"
"Jaumo Dating, Flirt & Live Video",Meet singles online and talk in a voice chat. Find friendship or love.
Patook - make platonic friends,Make strictly platonic friends who share your interests. No flirting allowed.
Zello PTT Walkie Talkie,Fast and simple walkie talkie app
magicApp Calling & Messaging,Never miss a call when you take your magicJack number with you.
"Dating App, Flirt & Chat : W-Match",Live video chat with random people around the world! Meet & Start dating!
uCiC- Videos and Photos on demand,"Make photo slideshow & video with music, video effect, glitch, text, sticker."
"Mico- Stranger Chat Random video Chat, Live, Meet",Watch streaming and meet friends
"Waplog - Free Chat, Dating App, Meet Singles","Greatest dating app to video chat, send voice messages and meet local singles!"
Amazon for Tablets,"Browse, search & buy millions of products right from your Android device."
Wish - Shopping Made Fun,"Fun Finds, Extraordinary Deals"
OfferUp - Buy. Sell. Offer Up,"Letgo is now part of OfferUp! Shop local items, find deals or sell in seconds"
Shopee - No. 1 Online Shopping,Guide for an online shopping app.
Shopee: No.1 Online Shopping,Guide for an online shopping app.
Kroger,"Save with Kroger! Coupons, ads, rewards, find stores & shopping list in one app!"
"AliExpress - Smarter Shopping, Better Living",Enjoy 3-10 workday delivery on selected items
Walmart,"Easy shopping, plus grocery delivery or curbside pickup."
eBay: Buy & Sell this Summer - Discover Deals Now!,"Buying & Selling On Fashion, Trading Cards, Cars, Second Hand, Vintage & more"
"letgo: Buy & Sell Used Stuff, Cars & Real Estate","Letgo is now part of OfferUp! Shop local items, find deals or sell in seconds"
Amazon Shopping,"Browse, search & buy millions of products right from your Android device."
Lazada - Online Shopping & Deals,Shop everything you want online with the exciting items at Lazada!
OLX - Buy and Sell,Sell It | Search It | Buy It
The wall,Meet The Wall - gripping quiz in which knowledge is as important as luck!
Flipp - Weekly Shopping,"Grocery coupons, deals & weekly ads. Find savings on furniture, clothing & more"
"Shrimp skin shopping: spend less, buy better","Fun Finds, Extraordinary Deals"
Lotte Home Shopping LOTTE Homeshopping,The beginning of a new day
"Horn, free country requirements",An infinite Air Horn in your pocket!
Jiji.ng,Buy & Sell Anything in Nigeria
GS SHOP,Mobile Shopping App
The birth,Time management & Idle pregnant factory game. Money tycoon & incremental games
CJmall,"CJ Mall, the new name of CJ O Shopping"
Home & Shopping - Only in apps. 10% off + 10% off,The NEW 99 Store App offers fresh features and exclusive deals just for 99ers.
EHS Dongsen Shopping,＊ Dongsen Shopping ‧ Select Good Things ＊ Skip-the-line shopping at famous stores ＊ Do not miss live shopping ＊ Buy for a limited time
bigbasket - online grocery,India's Largest Online Grocery Shopping App - Over 6 million happy customers!
Bukalapak - Buy and Sell Online,"Buy & Sell, Online Shopping, Indonesia Online Shopping"
Life market,Transforming unwanted or excess goods into a profitable commodity
Jabong Online Shopping App,Clothing stores Jabong Ajio Zivame Limeroad Club Factory Fbb Firstcry Big Bazaar
Family Dollar,"Now it’s even easier to save at Family Dollar, with instant access to offers."
Jumia online shopping,"Get ready for big deals, with Jumia 🛒, you always win!"
Mercado Libre: Find your favorite brands,"Shipping in 24 hours with the best opportunities: household appliances, electronics and +"
"Carousell: Snap-Sell, Chat-Buy","Buy and sell fashion & luxury items, electronics, home services, cars or houses"
Blibli.com Online Shopping,Indonesia Online Shopping | 100% Original | Fast Delivery
"Club Factory Everything, Unbeaten Price",2020 Latest Collection of Clothes to shop with your friends.
"Real Estate, Car, Shopping and Others","Shop millions of cars with deal ratings, save favorites, and get price alerts."
ZALORA Fashion Shopping,Meet the SHEIN app - Your one-stop shop for trends at prices you'll Love!
Magazine Luiza Online Shopping,"Search Magalu: from glitter to sambar sandals, special conditions for you"
ROMWE - Women's Fashion,Your aesthetic on lock
Buscapé - Offers and discounts,Plan your purchases: compare prices and offers from online stores and earn cashback!
Myntra Online Shopping App,Best Shopping App with +3500 Online Brands & Fashionable Clothes for Everyone
11st,My shopping address 11st
Coupang,"Enjoy your shopping with our app and get the best selection, pricing & benefits."
Wemep - Special price representative (special / shopping / shopping app / coupon / shipping),"Cash back, codes, and deals for your shopping, grocery, fashion & home needs"
Target - now with Cartwheel,"Plan, shop and save with the Target App, now with Target Circle."
Flipkart Online Shopping App,India’s Leading Shopping App
Sam's Club: Wholesale Shopping & Instant Savings,"Pickup, Delivery, Scan & Go"
Chilindo,Thailand's #1 auction site now available in Play Store. Try out our new app now!
Rossmann PL,"Rossmann PL application - scan by the shelf, pay in the application!"
"Jingdong - pick good things, go to Jingdong",Live up to every love
CheckPoints 🏆 Rewards App,CheckPoints Rewards App that makes you money
Extreme Coupon Finder,This is a MUST for any EXTREME Couponer. It has all the weekly Coupons Matchups.
SnipSnap Coupon App,"Unlock savings in-store & online, cheap fuel, freebies, & earn cash w/o receipts"
Checkout 51: Grocery coupons,Join over 18.5 million users who have earned more than 88 million in cash back!
Coupon Sherpa,"Get local coupons, online deals, check current benefits and more on your phone!"
Gyft - Mobile Gift Card Wallet,"Easily buy, send, manage and redeem gift cards from your phone!"
SavingStar - Grocery Coupons,Use our Cash Back Offers at ANY Store with an itemized receipt
The Coupons App,"Unlock savings in-store & online, cheap fuel, freebies, & earn cash w/o receipts"
"Shopkick: Free Gift Cards, Shop Rewards & Deals",Scan Receipts to Earn Gift Card Rewards! Cash Back Rewards & Coupon Gift Cards!
Key Ring: Cards Coupon & Sales,Keep all of your loyalty and membership cards in one app.
"Ibotta: Cash Back Savings, Rewards & Coupons App",Cash back on everything you need! Join now to start earning cash back!
"RetailMeNot - Coupons, Deals & Discount Shopping","Cash back, codes, and deals for your shopping, grocery, fashion & home needs"
"Groupon - Shop Deals, Discounts & Coupons",Save up to 70% on the things you need every day
"Kohl's: Scan, Shop, Pay & Save","Buy fashion, beauty, home, & more! Save with amazing shopping deals & discounts."
Stocard - Rewards Cards Wallet,All your rewards cards in one app!
Nike,"Kick off the year with the latest trends. Sneakers, clothes & Member-exclusives."
Poshmark - Buy & Sell Fashion,"Buy & sell fashion, home, beauty, & electronics. Shop brand new & used styles."
Mercari: The Selling App,Mercari is your marketplace for buying and selling preloved items.
Blidz - Hunt Free Deals On Trending Items!,Buy together for big savings ⎪E-shopping super app⎪Online Outlet Store
"Shopular: Coupons, Weekly Ads & Shopping Deals","Grocery coupons, deals & weekly ads. Find savings on furniture, clothing & more"
LivingSocial - Local Deals,Save up to 70% on the things you need every day
Coupons.com – Grocery Coupons & Cash Back Savings,Use our Cash Back Offers at ANY Store with an itemized receipt
"Ebates: Cash Back, Coupons, Rewards & Savings","Earn Cash Back at over 3,500 stores + stack coupons & deals"
FidMe Loyalty Cards & Deals at Grocery Supermarket,"Save ALL your loyalty cards, coupons, rewards & receipts in ONE wallet app!"
Ratings by Consumer Reports,Consumer Reports has ratings and reviews for 7500+ products.
HauteLook,Nordstrom Rack App for Android puts the brands you love at your fingertips
Nordstrom,"Clothing, Shoes & Handbags"
Modcloth – Unique Indie Women's Fashion & Style,"Discover & buy vintage-style fashion, unique dresses & indie designer clothing"
Fancy,Discover & buy amazing things. Get credit for sharing!
"Twice: Buy, Sell Clothing","Buy & sell fashion, home, beauty, & electronics. Shop brand new & used styles."
Slice: Package Tracker,The only way to track packages without entering a tracking number.
LightInTheBox Online Shopping,The LightInTheBox App can easily take you through a fantastic shopping journey.
Best Buy,"Learn, shop and save, all in one place."
JackThreads: Men's Shopping,"At JackThreads we believe style, quality, and value should be easily accessible."
zulily - Shop Daily Deals in Fashion and Home,Everyday Value & Daily Deals
MiniInTheBox Online Shopping,Electronic accessories & gadgets at wholesale prices with FREE Shipping
Zappos – Shoe shopping made simple,"Quality shoes, clothes, sandals & more with great customer service"
Urban Outfitters,"Use the UO app to shop FILA & adidas clothes, plus new furniture & décor."
Tophatter - 90 Second Auctions,DealDash - Save Up To 99% + Free Shipping
Shopfully - Weekly Ads & Deals,"Grocery coupons, deals & weekly ads. Find savings on furniture, clothing & more"
Slickdeals: Coupons & Shopping,"Get the deals, discounts, & coupons - save with promo codes & offers!"
Wanelo Shopping,3D View Wholesale Online Shopping Without Any Risk
Etsy: Handmade & Vintage Goods,"Shop our global marketplace of handmade, vintage and creative goods"
ASOS,"Shop 850+brands, latest trends & new in, get your daily fashion fix on our app."
"Overstock – Home Decor, Furniture Shopping",Make your dream home come true with daily deals on stylish furniture and décor.
Find&Save - Local Shopping,"Fun Finds, Extraordinary Deals"
Receipt Hog - Receipts to Cash,"Get rewarded for every purchase you make, online or in-store!"
ShopSavvy Barcode & QR Scanner,"Barcode Reader. Scan Barcodes & QR Codes. Scanner App,QR Codes & Product Scanner"
"Savory - Deals,Freebies,Sales",Saviry brings you all the best deals on the web!
Newegg Mobile,Download the Newegg App today and start saving money by shopping our best deals!
REI – Shop Outdoor Gear,Your on-the-go companion to shop outdoor gear and apparel you love from REI.
The Home Depot,"Search, browse and shop over a million products directly from The Home Depot."
Boxed Wholesale,"Boxed is the world's most convenient warehouse club! Bulk products, tiny prices."
La La-Shop Designer Brands Street,"Shop luxury clothing, fashion brands, beauty & global boutiques all in one place"
TouchNote: Cards & Gifts,Send custom-made cards and meaningful gifts with worldwide delivery
"Shutterfly: Free Prints, Photo Books, Cards, Gifts","Find personalized gifts, prints, cards, wall art & decor on the Shutterfly app!"
FreePrints – Free Photos Delivered,"Print up to 1,000 4x6 photos a year for FREE! No subscriptions. No commitments."
Groovebook Photo Books & Gifts,"Find personalized gifts, prints, cards, wall art & decor on the Shutterfly app!"
"Moony Lab - Print Photos, Books & Magnets ™","Photo books, square prints, magnets from your mobile, Instagram or FB photos"
"LALALAB prints your photos, photobooks and magnets","Print your photos in 5 minutes: Prints, Boxes, Photo Albums, Wall Art & Magnets"
Snapfish,"Get 100 pics a month on us! Create Photo Gifts, Tiles, Mugs, Cards + Calendars"
Google Photos,"The home for your memories. Relive, share, and organize your photos."
Motorola Camera,"A whole new experience!! Insightful, Clutter-free, Organized, Works with Nest"
HD Camera - Best Cam with filters & panorama,"Amazing quick snap with HD camera, shooting filter provides professional effects"
"Face Filter, Selfie Editor - Sweet Camera","Beauty camera and photo editor with filters, stickers, and pic collage maker"
LightX Photo Editor & Photo Effects,"Make Photo Collage & Photo Frames, Photo background changer & Blur Photo Editor"
"Sweet Snap - live filter, Selfie photo edit","Beauty plus camera to snap sweet selfie, live stickers & face filters & makeup."
Adobe Photoshop Express:Photo Editor Collage Maker,Up your social media game & create standout content with Photoshop Express.
HD Camera - Quick Snap Photo & Video,A fully featured high definition camera HyCam with powerful gallery and editor
B612 - Beauty & Filter Camera,"Meet trendy effects, filters, and stickers!"
Waterfall Photo Frames,To decorate your photos with waterfall photo frames and make them unforgettable.
Photo frame,150+ stylish layout to make a collage. Numerous beautiful frames.
Huji Cam,Just Like The Year 1998
Unicorn Photo,Unicorn stickers game. Unicorn photo editor for girls! Add unicorn horn on photo
HD Camera,HD Camera is incredible professional camera app!
Makeup Editor -Beauty Photo Editor & Selfie Camera,Makeup Camera is a professional makeup editor and selfie filter
Makeup Photo Editor: Makeup Camera & Makeup Editor,Beauty camera to apply makeup to your face & tune your selfie
Moto Photo Editor,Edit your Cutout photos
InstaBeauty -Makeup Selfie Cam,Now you can make selfie photo with multiple camera effects.
Garden Photo Frames - Garden Photo Editor,Make your awesome photo using Garden photo frames
Photo Frame,150+ stylish layout to make a collage. Numerous beautiful frames.
Camera360 Lite - Selfie Camera,Sweet selfie camera & photo editor with expressive filters
Selfie Camera - Photo Editor & Filter & Sticker,"Funny photo filters and effects & selfie camera effects, art face filter camera!"
"Sweet Snap Lite - live filter, Selfie photo editor","Selfie camera, live filter, makeup editor, stickers & face filter"
"Selfie Camera: Beauty Camera, Photo Editor,Collage",Photo Editor Collage Maker & Beauty Camera
Night Photo Frame,Decorate your photo in beautiful night background and make them more romantic!
YouCam Makeup - Magic Selfie Makeovers,Beauty camera to apply makeup to your face & tune your selfie
Selfie Photo Editor,"Create the perfect selfie! Custom beauty cam, stickers & filters for pictures"
BeautyPlus - Easy Photo Editor & Selfie Camera,Get the perfect photo EVERY time with our amazing Auto-Beautification tool
ASUS Gallery,"Smart, light, and fast photo and video gallery"
My Photo Keyboard,"My Photo Keyboard theme 2023 offers emoji, Led Themes and gifs picture Keyboard."
Kids Photo Frames,Baby photo frames: Make cute kids pictures with kids frames & baby frames.
Pencil Photo Sketch-Sketching Drawing Photo Editor,Create beautiful pencil sketch & drawing of your photos with Pencil Photo Sketch
"Pretty Makeup, Beauty Photo Editor & Snappy Camera",Pretty makeup photo editor with magic makeover and beauty selfie camera
Photo Collage - Layout Editor,"Pic collage maker & photo editor with 300+ layout, grid, filter, sticker, text."
DSLR Camera Hd Ultra Professional,DSLR Hd camera capture high quality 4k hd picture with filters and blur editor
Snap Cat Face Camera,"Beauty plus camera to snap sweet selfie, live stickers & face filters & makeup."
Silent Camera [High Quality],Introducing the best silent camera! Highest quality photos for you.
"Sweet Camera - Selfie Filters, Beauty Camera","Beauty camera and photo editor with filters, stickers, and pic collage maker"
Photo Frames,"Lots of photo frames,collages, sticker & photo background changer tool."
"Sweet Selfie - selfie camera, beauty cam, photo edit","Beauty camera and photo editor with filters, stickers, and pic collage maker"
"Candy selfie - photo editor, live filter camera",Filters for photos and videos Beautification tools for flawless selfies
YouCam Perfect - Selfie Photo Editor,"Create the perfect selfie! Custom beauty cam, stickers & filters for pictures"
Open Camera,Open Source Camera app.
Beauty Makeup – Photo Makeover,"One-tap Makeup, Fine-tune Eyes, Lipstick, Auto-beauty Retouch, Photo makeover..."
Blur Image Background Editor (Blur Photo Editor),Blur photo background with amazing blur effects in this auto blur photo editor.
Muzy - Share photos & collages,"Pic collage maker & photo editor with 300+ layout, grid, filter, sticker, text."
QuickPic - Photo Gallery with Google Drive Support,Cheeta Mobile App Quickpic
Flickr,"Upload, organize, edit, and share your photos from anywhere in the world."
Camera for Android,Android Native system HD camera app. Never been so simple and faster.
Photo Editor Selfie Camera Filter & Mirror Image,Flip multiple images together. You can also rotate images
Photo Mixer,"A Photo Blender app to Mix, Overlay and Blend Multiple Pictures."
Photo Editor-,"AI photo editor & cartoon photo editor for collage maker, profile maker & aging"
"Cymera Camera- Photo Editor, Filter,Collage,Layout",Photo Editor Collage Maker & Beauty Camera
Wondershare PowerCam,"Shoot it, Style it, Share it."
love,My Love shows you how long you and your partner have already been together.
LINE Camera - Photo editor,Make your photos fun & attractive♪
InstaSize Photo Filters & Collage Editor,"Easily resize and crop pictures, remove background, and edit with filters"
"KVAD Camera +: Selfie, Photo Filter, Grids",Filter camera app and camera app. Camera effects and selfie photo. Grids
"Candy Camera - selfie, beauty camera, photo editor",Filters for photos and videos Beautification tools for flawless selfies
Photo Editor,"AI photo editor & cartoon photo editor for collage maker, profile maker & aging"
Camera51 - a smarter camera,Concern your parents/kids/pets any time any where.
InstaCam - Camera for Selfie,Get a fast and cute camera with high shutter speed.
"Phogy, 3D Camera",Create the Coolest Phogy Selfie with 3D Effect!
Sweet Camera,"Beauty plus camera to snap sweet selfie, live stickers & face filters & makeup."
Camera360: Selfie Photo Editor with Funny Sticker,"Make awesome portraits with retouching tools, classic filters and beauty looks"
RetroSelfie - Selfie Editor,"Look fabulous with RetroSelfie's filters and effects, selected for selfies!"
Mega Photo,The most fun you can have with your photos!
Blur Image Background,"blur photo editor with background changer of photo effects, filters & stickers"
MIX by Camera360,Photo Editor Pro&Rich Editing Tools&Share Your Own Photo Filter to MIX Community
Facetune - For Free,"Photo editor, filters for selfies and beauty effects. Enhance and retouch photos"
SuperPhoto - Effects & Filters,"Tons of awesome effects and filters for your gallery, camera & social photos!"
Camera FV-5 Lite,Professional camera app that brings DSLR manual photography controls to Android.
HD Camera Ultra,High definition camera application. Extra high quality and performance.
Cameringo Lite. Filters Camera,A professional camera to give you back the pleasure of taking beautiful photos.
Camera ZOOM FX - FREE,The Newest Full HD Zoom Camera with extra zooming power and superb design
HD Camera Pro for Android,Professional photography on your mobile phone
HD Camera for Android,A simple and professional HD camera & selfie camera for all devices.
GoPro (formerly Capture),Auto video maker with music & exclusive filters. Video editing made simple.
Photo Editor Pro,"AI photo editor & cartoon photo editor for collage maker, profile maker & aging"
Beauty Makeup Snappy Collage Photo Editor - Lidow,Photo editor pretty makeup and square collage maker sweet camera for Instagram
Samsung SMART CAMERA App,Control & Share photos with the latest Samsung Camera via wireless.
Square InPic - Photo Editor & Collage Maker,Create beautiful photos with easy to use photo editor and collage maker!
"High-Speed Camera (GIF,Burst)",Click multiple shots using this Ultra High Speed Camera for the best clear photo
Camera MX - Free Photo & Video Camera,A simple and faster way to capture moments. This is an native system Camera MX.
Lapse It • Time Lapse • Pro,Capture amazing time lapse and stop motion videos with this award-winning app.
EyeEm - Camera & Photo Filter,Sell your photos and connect with photography experts around the world
Retrica,The catalyst of great photos
VSCO,Create & edit videos using filters & effects. Make collages with editing tools.
Camera FV-5,Professional camera app that brings DSLR manual photography controls to Android.
PhotoWonder: Pro Beauty Photo Editor Collage Maker,"Photo editor and camera app to create collage, beauty & style"
Photo Effects Pro,Tons of cool special effects for all of your photo editing needs
No Crop & Square for Instagram,Post full sized pics on Instagram without cropping! Square photo easily
Picture Grid Builder,Photo Collages in awesome Picture grids shapes with Stickers and Draw on Photos.
Photo Studio,Photo editor: combine photos and edit pictures with a photo filter app.
FilterGrid - Cam&Photo Editor,Create & edit videos using filters & effects. Make collages with editing tools.
Mirror Photo:Editor Collage (HD),"Photo mirror app & picture editor with fun collage maker, selfie camera filters."
Pic Stitch - #1 Collage Maker,Quickly combine multiple photos into beautifully framed collages with PicStitch.
PhotoDirector Photo Editor App,Edit and animate pictures with powerful AI and creative tools!
Pic Collage - Photo Editor,Create Valentines with your own photos and videos for a unique way to celebrate!
Photo Editor by Aviary,The one & only Photo Editor for Android™ helps you get your photos better!
"Video Editor Music,Cut,No Crop","Pro Video Editor with Music! Edit video with effects, slideshow & slow motion"
Pixlr – Free Photo Editor,"A free photo, collage and sticker editor."
Photo Collage Maker,"Pic collage maker & photo editor with 300+ layout, grid, filter, sticker, text."
PicsArt Photo Studio: Collage Maker & Pic Editor,Use text to image to generate and edit custom images in different styles.
Photo Collage Editor,"Pic collage maker & photo editor with 300+ layout, grid, filter, sticker, text."
Color Touch Effects,Color Touch Effects allows to recolor images and apply cool photo effects.
"Z Camera - Photo Editor, Beauty Selfie, Collage",Photo Editor Collage Maker & Beauty Camera
"PhotoGrid: Video & Pic Collage Maker, Photo Editor",Foto Grid Collage Maker & Photo Editor remixs pictures & layouts into collages.
Pixgram- video photo slideshow,The BEST app to make a creative video and slideshow with music you love.
Fotor Photo Editor - Photo Collage & Photo Effects,"AI photo enhancer, background remover, retouch, magic eraser and design template"
Snapseed,Professional quality photo edits with the new Snapseed.
Font Studio- Photo Texts Image,"write fancy text with easy text app, text art, Text on Photo - Text to Photo"
Add Text To Photo,All-in-one editor for text creation with 1000+ fonts
Phonto - Text on Photos,Phonto is a simple app that allows you to add text to photos.
Collage&Add Stickers papelook,The most kawaii editor for your nice photos. Lots of stickers and frames!🦄 🌈
Photo Collage - InstaMag,Foto Grid Collage Easy To Create Awesome Photo Collage Maker & Photo Mixer
"Meitu – Beauty Cam, Easy Photo Editor",Filters & Selfie Retouch
ESPN,"Get scores, news, alerts & watch live sports"
Free Sports TV,"Watch Live Sports & Get Custom Alerts: Football, Baseball, Boxing & more"
LiveScore: Live Sport Updates,"Scores, results, stats and news for football & the world's biggest sport events."
MLB At Bat,The #1 source for live baseball. The official app of Major League Baseball.
NFL,"The official app of the NFL is the best, pure football app for any fan!"
"theScore: Live Sports Scores, News, Stats & Videos","Scores, news, stats, videos for NFL, NBA, MLB, NHL, EPL, PGA, MMA, NCAA and more"
Onefootball - Soccer Scores,"All Soccer news, fixtures, stats, calendars, results and transfers"
Cristiano Ronaldo Wallpaper,Cristiano Ronaldo Free Wallpapers 2022 HD 4k
"FIFA - Tournaments, Soccer News & Live Scores",The Official World Cup™ App
Futbol24,Your fast and reliable soccer app with live scores from over 2.000 leagues
kicker football news,All information about Germany's most important sport football and more!
Football Live Scores,"Scores, results, stats and news for football & the world's biggest sport events."
Pro 2018 - Series A and B,Stream Movies & TV Shows — No Cost Or Monthly Fees
BeSoccer - Soccer Live Score,"BeSoccer - Livescore | Breaking news, standings and soccer live scores"
Sport.pl LIVE,Sports coverages and live scores from around the world! All Free!
FotMob - Live Soccer Scores,"The essential soccer app for live scores, match updates, stats, and news."
Yahoo Fantasy Sports - #1 Rated Fantasy App,Play fantasy football & daily contests. Draft & manage fantasy baseball & more.
"CBS Sports App - Scores, News, Stats & Watch Live","CBS Sports is your source for top sports news, scores, videos and more!"
"The Team - Live Sport: football, tennis, rugby ..","Watch Live Sports & Get Custom Alerts: Football, Baseball, Boxing & more"
MARCA - Sports Leader Diary,"All sports information, live football scores and other sports."
Sahadan Live Scores,"En hızlı bildirimler, Canlı Sonuçlar, İddaa oranları ve daha fazlası."
BBC Sport,"The latest sport action across football, cricket, rugby, tennis, F1 and more!"
